Grand Monster Slam	Kenny Dalglish Soccer Manager	Bill Laimbeer's Combat Basketball	Championship Manager	Premier Manager	Championship Manager 93/94	Premier Manager 2	Premier Manager 3	Australian Rugby League	Championship Manager 2	Championship Manager 96/97	FIFA 97	Championship Manager: Season 97/98	Colony Wars	Colony Wars: Vengeance	Championship Manager 3	ISS Pro Evolution	Out of the Park Baseball	Flying Heroes	O'Leary Manager 2000	Championship Manager: Season 01/02	Football Manager 2005	SoccerProject	Football Manager 2006	Pro Evolution Soccer 5	Championship Manager 2006	Championship Manager 2007	FIFA 07	Football Manager 2007	Let's Make a Soccer Team!	Maximum-Football	FIFA 08	Pro Evolution Soccer 2008	FIFA Manager 09	Football Manager Live	Pro Evolution Soccer 2009	Championship Manager 2009 Express	Championship Manager 2010	Football Manager 2010	Football Tycoon	PerfectGoal	Pro Evolution Soccer 2010	EA Sports FIFA Superstars	Football Manager 2011	Pro Evolution Soccer 2011	FIFA Manager 12	Football Manager 2012	Pro Evolution Soccer 2011 3D	Pro Evolution Soccer 2012	Football Manager 2013	Warsow	Football Manager 2014	Path of Exile	Pro Evolution Soccer 2014
Kirby's Dream Land	Kirby's Adventure	Kirby's Pinball Land	Kirby's Dream Course	Kirby's Avalanche	Kirby's Dream Land 2	Kirby Super Star	Kirby's Dream Land 3	Kirby 64: The Crystal Shards	Kirby Tilt 'n' Tumble	Kirby: Canvas Curse	Kirby: Squeak Squad	Kirby's Epic Yarn	Kirby Mass Attack	Kirby's Return to Dream Land	Kirby's Dream Collection	Kirby: Triple Deluxe
64th Street: A Detective Story	Arabian Fight	Knuckle Bash	The Peace Keepers	The Punisher	Mad Stalker: Full Metal Force	Donkey Kong Jungle Beat	Elite Beat Agents	Rhythm Tengoku	Beats	El Tigre: The Adventures of Manny Rivera	Ontamarama	Bit.Trip Beat	Bit.Trip Core	Bit.Trip Void	Maestro! Jump in Music	Bit.Trip Runner	Joey Kramer Hit Hard	Kick-Ass: The Game	Alvin and the Chipmunks: Chipwrecked	Bit.Trip Flux
Donkey Kong Jr.	Donkey Kong Jr. Math	Dallas Quest	Ken Griffey, Jr. Presents Major League Baseball	Ken Griffey, Jr.'s Winning Run	Major League Baseball Featuring Ken Griffey, Jr.	Ken Griffey, Jr.'s Slugfest	Death Jr.	Death, Jr. and the Science Fair of Doom	Mario Super Sluggers
Dizzy – The Ultimate Cartoon Adventure	Treasure Island Dizzy	Fantasy World Dizzy	Magicland Dizzy	Quattro compilations	Spellbound Dizzy	Fantastic Dizzy	Seymour Goes to Hollywood	Slightly Magic	The Excellent Dizzy Collection
SingStar (PlayStation 3)	SingStar ABBA	SingStar Take That	U-Sing	We Sing	We Sing Encore	We Sing Robbie Williams	We Sing Deutsche Hits	We Sing Down Under	We Sing Rock!	We Sing UK Hits	We Sing 80s	We Sing Pop!
Top Shop	Rugrats: Totally Angelica	Metropolismania	Ran Online	Perfect World	Hammer Heads	Tamagotchi Connection: Corner Shop 2	Recettear: An Item Shop's Tale	Style Savvy	Atelier Annie: Alchemists of Sera Island	Cooking Mama 3: Shop & Chop	Allods Online	We Rule	Drakensang Online	Real Madrid Fantasy Manager	Style Savvy: Trendsetters
Tank	Panther	Combat	Armor Battle	Armor Attack	Battlezone	Super Cobra	Triple Action	Bolo	Front Line	Stellar 7	Battle City	Arcticfox	Bolo	Fire Power	Assault	Conqueror	Iron Tank	Vindicators	M1 Tank Platoon	Tank Wars	Metal Max	Scorched Earth	Spectre	Utopia: The Creation of a Nation	X	BZFlag	Scorched Tanks	Return Fire	Tokyo Wars	BattleTanx	BattleTanx: Global Assault	Recoil	Tanktics	Panzer Front	Tread Marks	Scorched 3D	Jet Set Radio Future	Seek and Destroy	Steel Battalion	Finding Nemo	Insaniquarium	Space Tanks	Operation Shadow	Panzer Front Ausf.B	Dragon Quest Heroes: Rocket Slime	Heavy Weapon	Metal Saga	Metal Saga: Season of Steel	Panzer Elite Action: Fields of Glory	Red Orchestra: Ostfront 41-45	Tetris Splash	Codename: Panzers – Cold War	Company of Heroes: Tales of Valor	Metal Max 3	World of Tanks	Men of War: Assault Squad	Steel Battalion: Heavy Armor
The Transformers	The Transformers: Mystery of Convoy	Transformers: The Battle to Save the Earth	Transformers: The Headmasters	Transformers	Transformers	Transformers: Armada	Transformers Autobots	Transformers: The Game	Transformers Animated: The Game	Transformers G1: Awakening	Transformers Revenge of the Fallen: Autobots	Transformers Revenge of the Fallen: Decepticons	Transformers: Revenge of the Fallen	Transformers: Cybertron Adventures	Transformers: War for Cybertron	Transformers: War for Cybertron (Nintendo DS)	Transformers: Dark of the Moon	Transformers: Fall of Cybertron	Transformers: Prime – The Game
Final Fantasy Adventure	Secret of Mana	Seiken Densetsu 3	Neon Genesis Evangelion: Girlfriend of Steel	Legend of Mana	The Devil Inside	Atelier Iris: Eternal Mana	Atelier Iris 2: The Azoth of Destiny	Atelier Iris 3: Grand Phantasm	Children of Mana	Dawn of Mana	Heroes of Mana	GodFinger	Puzzle Quest 2
Mickey Mousecapade	Adventures in the Magic Kingdom	Castle of Illusion Starring Mickey Mouse	QuackShot	Disney's Magical Quest	Kid Klown in Night Mayor World	Land of Illusion Starring Mickey Mouse	World of Illusion Starring Mickey Mouse and Donald Duck	Mickey Mouse: Magic Wands!	The Real Ghostbusters	Mickey Mania: The Timeless Adventures of Mickey Mouse	Mickey no Tokyo Disneyland Daibōken	Mickey's Ultimate Challenge	Disney's Magical Mirror Starring Mickey Mouse	Kingdom Hearts coded	Epic Mickey	Kinect Disneyland Adventures	Epic Mickey 2: The Power of Two	Epic Mickey: Power of Illusion	Castle of Illusion Starring Mickey Mouse
Mutation Nation	Luxor	Luxor 2	Prey	Luxor 3	ZenGems	Luxor: Quest for the Afterlife
Tron: Deadly Discs	Windjammers	The Journeyman Project 2: Buried in Time	The Journeyman Project: Pegasus Prime	The Journeyman Project 3: Legacy of Time	Queen: The eYe	Threads of Fate	Deathrow	Ridge Racer	Big Bumpin'	PocketBike Racer	Sneak King	Xbox Live Arcade Unplugged	Drop7	Grand Theft Auto: Episodes from Liberty City	Disney Infinity
Nancy Drew: Secrets Can Kill	Nancy Drew: Stay Tuned for Danger	Nancy Drew: Message in a Haunted Mansion	Nancy Drew: The Final Scene	Nancy Drew: Treasure in the Royal Tower	Nancy Drew: Ghost Dogs of Moon Lake	Nancy Drew: Secret of the Scarlet Hand	Nancy Drew: Danger on Deception Island	Nancy Drew: Curse of Blackmoor Manor	Nancy Drew: The Secret of Shadow Ranch	Nancy Drew: Last Train to Blue Moon Canyon	Nancy Drew: Secret of the Old Clock	Nancy Drew: Danger By Design	Nancy Drew: The Creature of Kapu Cave	Nancy Drew: Legend of the Crystal Skull	Nancy Drew: The White Wolf of Icicle Creek	Nancy Drew Dossier: Lights, Camera, Curses	Nancy Drew: The Haunting of Castle Malloy	Nancy Drew: The Phantom of Venice	Nancy Drew Dossier: Resorting to Danger	Nancy Drew: Ransom of the Seven Ships	Nancy Drew: Warnings at Waverly Academy	Nancy Drew: Secrets Can Kill Remastered	Nancy Drew: Shadow at the Water's Edge	Nancy Drew: Trail of the Twister	Nancy Drew: Alibi in Ashes	Nancy Drew: The Captive Curse	Nancy Drew: The Deadly Device	Nancy Drew: Tomb of the Lost Queen	Nancy Drew: Ghost of Thornton Hall	Nancy Drew: The Silent Spy
Space Firebird	Demons to Diamonds	Xyphus	Seikima II Akuma no Gyakushū!	Digital Devil Story: Megami Tensei	Spirit Warrior	Devilman	Xak: The Art of Visual Stage	Creatures	Digital Devil Story: Megami Tensei II	Fray in Magical Adventure	Xak II: Rising of the Redmoon	Xak: The Tower of Gazzel	Battle Blaze	Gargoyle's Quest II	Megami Tensei Gaiden: Last Bible	Shin Megami Tensei	Xak I & II	Xak III: The Eternal Recurrence	Demon's Crest	Fray CD	Majin Tensei	Shin Megami Tensei if...	Shin Megami Tensei II	Far East of Eden Zero	Shin Megami Tensei: Devil Summoner	Revelations: Persona	Shin Megami Tensei: Devil Summoner: Soul Hackers	Persona 2	Catechumen	Shin Megami Tensei: Devil Children	Summoner	Devil May Cry	Jackie Chan Adventures	Ominous Horizons: A Paladin's Calling	Stretch Panic	Buffy the Vampire Slayer	Enclave	Otogi: Myth of Demons	Devil May Cry 2	The Legend of Sword and Fairy 2	Chinese Paladin 3	Onimusha Blade Warriors	Primal	Shin Megami Tensei: Nocturne	Forgotten Realms: Demon Stone	Shin Megami Tensei: Digital Devil Saga	Yu Yu Hakusho: Tournament Tactics	Constantine	Daemonica	Jingai Makyō	Ururun Quest: Koiyuuki	Bullet Witch	Disgaea 2: Cursed Memories	Shin Megami Tensei: Devil Summoner: Raidou Kuzunoha vs. The Soulless Army	Ghost Rider	Heroes of Might and Magic V: Tribes of the East	InuYasha: Secret of the Divine Jewel	Shin Megami Tensei: Imagine	Devil May Cry 4	Doom II RPG	Painkiller: Resurrection	Shin Megami Tensei: Devil Survivor	Shin Megami Tensei: Strange Journey	Disgaea 4: A Promise Unforgotten	Shadows of the Damned	Shin Megami Tensei: Devil Survivor 2	NeverDead	Demon Gaze	DmC: Devil May Cry	Shin Megami Tensei IV	Bound by Flame
Loco-Motion	Super Locomotive	Stop the Express	The Train Game	A-Train	Southern Belle	Railroad Tycoon	Transarctica	Transport Tycoon	1830: Railroads & Robber Barons	Densha de Go!	Densha de Go! 64	Simutrans	Bridge Builder	Microsoft Train Simulator	Syberia II	Railfan: Chicago Transit Authority Brown Line	Rail Simulator	Railfan: Taiwan High Speed Rail	City Bus Simulator	RailWorks	RailWorks 3
Bart Simpson's Escape from Camp Deadly	The Simpsons: Bart vs. the Space Mutants	The Simpsons: Bart vs. the World	The Simpsons Arcade Game	The Simpsons: Bart's House of Weirdness	The Simpsons: Bartman Meets Radioactive Man	The Simpsons: Bart's Nightmare	The Simpsons: Bart vs. The Juggernauts	Virtual Bart	The Simpsons: Bart & the Beanstalk	The Simpsons: Cartoon Studio	The Simpsons: Virtual Springfield	The Simpsons: Road Rage	The Simpsons: Night of the Living Treehouse of Horror	The Simpsons Skateboarding	The Simpsons Game
Heli Fire	Polaris	Utopia	Sub Hunt	Godzilla	Jaws	PT-109	Cobra Triangle	Wolfpack	Lost Admiral Returns	Operation Neptune	Aces of the Deep	SSN-21 Seawolf	The Yukon Trail	Silent Steel	Silent Hunter	Tom Clancy's SSN	Bass Hunter 64	Virtual Sailor	Blood Wake	Silent Hunter II	Destroyer Command	Silent Hunter III	Battlestations: Midway	Silent Hunter 4: Wolves of the Pacific	Deadliest Catch: Alaskan Storm	Silent Hunter 4: Wolves of the Pacific U-Boat Missions	Hydro Thunder Hurricane	Silent Hunter 5: Battle of the Atlantic
Faxanadu	MUME	Death Gate	Realms of Arkania: Star Trail	Elf Bowling	Diggles: The Myth of Fenris	Disciples II: Dark Prophecy	The Hobbit	Mega Man Zero 2	SpellForce: The Order of Dawn	Warcraft III: The Frozen Throne	Mega Man Zero 3	ArchLord	Kingdom Under Fire: Heroes	Mega Man Zero 4	Dungeon Siege II: Broken World	Heroes of Annihilated Empires	SpellForce 2: Shadow Wars	Silverfall	World of Warcraft: The Burning Crusade	The Lord of the Rings Online: Mines of Moria	Rohan: Blood Feud	Elven Legacy	The Lord of the Rings Online: Siege of Mirkwood	The Lord of the Rings: War in the North	The Lord of the Rings Online: Rise of Isengard	The Lord of the Rings Online: Helm's Deep
Gunnm: Martian Memory	Charlie's Angels	Djibril – The Devil Angel	Shade: Wrath of Angels	Angels Online	Blazing Angels: Squadrons of WWII	Galaxy Angel II	Doki Doki Majo Shinpan!	Gangstar Rio: City of Saints	Wasteland Angel	Super Heroine Chronicle
Wizard	Chaos: The Battle of Wizards	Might and Magic Book One: The Secret of the Inner Sanctum	Feud	The Magic of Scheherazade	Ranarama	The Astyanax	Bloodwych	Dungeon Magic: Sword of the Elements	Faria: A World of Mystery and Danger	Theldrow	Lords of Chaos	The Immortal	Magician	Spellcraft: Aspects of Valor	Dark Wizard	The Legacy: Realm of Terror	Magic Carpet	Master of Magic	Magic Carpet 2	Tunshi Tiandi 3	Where's Waldo at the Circus	Rudra no Hihō	Magic and Mayhem	Crusaders of Might and Magic	Sacrifice	Soulbringer	Clive Barker's Undying	Age of Wonders II: The Wizard's Throne	Arx Fatalis	Shifters	Darkened Skye	Age of Wonders: Shadow Magic	Magic: The Gathering – Battlegrounds	Champions: Return to Arms	Wizard	Xanadu Next	The Endless Forest	LostMagic	Avencast: Rise of the Mage	Crowns of Power	Defend Your Castle	Wizard101	The Legend of Mir 3	Trine	Wizards of Waverly Place: Spellbound	Magicka	Sorcery	Magus
Tomb Raider	Tomb Raider II	Tomb Raider III	Tomb Raider: The Last Revelation	Tomb Raider Chronicles	Tomb Raider: Curse of the Sword	Tomb Raider: The Angel of Darkness	Tomb Raider: Legend	Tomb Raider: Anniversary	Tomb Raider: Underworld	Lara Croft and the Guardian of Light	Tomb Raider
Nintendo World Championships	Myst	Astonishia Story	The Legend of Heroes: A Tear of Vermillion	Riven	Age of Empires II: The Age of Kings	The Legend of Zelda: Oracle of Seasons and Oracle of Ages	Myst III: Exile	Golden Sun: The Lost Age	Uru: Ages Beyond Myst	LifeSigns: Surgical Unit	Myst IV: Revelation	Yin-Yang! X-Change Alternative	Big Brain Academy	Brain Age: Train Your Brain in Minutes a Day!	Brain Age 2: More Training in Minutes a Day!	Myst V: End of Ages	Mind Quiz: Exercise Your Brain	Mind Quiz: Your Brain Coach	Brain Challenge	Flash Focus: Vision Training in Minutes a Day	Myst Online: Uru Live	Brain Age Express	Nostalgia	Brain Exercise with Dr. Kawashima	Stronghold Kingdoms	Body and Brain Connection	Tiger Woods PGA Tour 13
Contra	Super Contra	Vice: Project Doom	Contra Force	Contra III: The Alien Wars	Contra: Hard Corps	Contra: Legacy of War	The Contra Adventure	Contra: Shattered Soldier	Lethal Enforcers 3	Neo Contra	Contra 4	Contra ReBirth	Hard Corps: Uprising
Wizardry II: The Knight of Diamonds	Finders Keepers	Spellbound	Dark Castle	Firelord	Joust 2: Survival of the Fittest	Knight Tyme	Beyond Dark Castle	Stormbringer	Conquests of Camelot: The Search for the Grail	Crossed Swords	Spirit of Excalibur	Moonstone: A Hard Days Knight	Vengeance of Excalibur	Cacoma Knight in Bizyland	The Beast Within: A Gabriel Knight Mystery	Clockwork Knight 2	Chronicles of the Sword	TorilMUD	Color Dark Castle	Guardian's Crusade	Gabriel Knight 3: Blood of the Sacred, Blood of the Damned	Hype: The Time Quest	Arthur's Knights	Prism Heart	Gotcha Force	Shining Soul II	Knights of the Temple: Infernal Crusade	The Elder Scrolls IV: Knights of the Nine	Age of Chivalry	Pirates, Vikings and Knights II	Knights in the Nightmare	Luminous Arc 2	Return to Dark Castle	White Knight Chronicles	World of Warcraft: Wrath of the Lich King	Ghosts 'n Goblins: Gold Knights	Undead Knights	White Knight Chronicles II	King Arthur's Gold	Spiral Knights
Mega Man	Mega Man 2	Mega Man 3	Mega Man 4	Mega Man II (Game Boy)	Mega Man: Dr. Wily's Revenge	Mega Man 5	Mega Man III (Game Boy)	Mega Man 6	Mega Man IV (Game Boy)	Mega Man X	Wily & Right no RockBoard: That's Paradise	Mega Man Soccer	Mega Man V	Mega Man X2	Mega Man: The Wily Wars	Mega Man	Mega Man 7	Mega Man X3	Mega Man: The Power Battle	Mega Man 8	Mega Man 2: The Power Fighters	Mega Man Legends	Mega Man X4	Mega Man & Bass	Super Adventure Rockman	Rockman & Forte Mirai kara no Chōsensha	Rockman Complete Works	Mega Man Legends 2	Mega Man Battle Network	Mega Man Battle Network 2	Mega Man Battle Network 3	Mega Man Zero	Mega Man Battle Network 4	Mega Man Network Transmission	Mega Man X7	Mega Man Anniversary Collection	Mega Man Battle Network 5	Mega Man X8	Rockman EXE 4.5 Real Operation	Rockman EXE Battle Chip Stadium	Mega Man Powered Up	Mega Man Star Force	Mega Man X Collection	Mega Man ZX	Mega Man ZX Advent	Mega Man 9	Rockman EXE Operate Shooting Star	Mega Man 10	Street Fighter X Mega Man
Rayman	Rayman 2: The Great Escape	Rayman M	Rayman 3: Hoodlum Havoc	Rayman: Hoodlums' Revenge	Rayman Raving Rabbids	Rayman Raving Rabbids (handheld game)	Rayman Raving Rabbids 2	Rayman Raving Rabbids: TV Party	Rayman Origins	Rayman Legends
Castlevania	Dracula	Vampire Killer	Castlevania II: Simon's Quest	Haunted Castle	Castlevania III: Dracula's Curse	Castlevania: The Adventure	Akumajō Special: Boku Dracula-kun	Super Castlevania IV	Master of Darkness	Castlevania Chronicles	Bram Stoker's Dracula	Castlevania: Rondo of Blood	Kid Dracula	Castlevania: Bloodlines	Castlevania Legends	Castlevania: Symphony of the Night	Castlevania (Nintendo 64)	Castlevania: Legacy of Darkness	Dracula 2: The Last Sanctuary	Dracula: Resurrection	Castlevania: Circle of the Moon	Castlevania: Harmony of Dissonance	Castlevania: Aria of Sorrow	Castlevania: Lament of Innocence	Van Helsing	Castlevania: Curse of Darkness	Castlevania: Portrait of Ruin	Castlevania: Order of Shadows	Barnyard Blast: Swine of the Night	Castlevania Judgment	Castlevania: Order of Ecclesia	Dracula: Origin	Castlevania: The Adventure ReBirth	Castlevania: Harmony of Despair	Castlevania: Lords of Shadow	Castlevania: Lords of Shadow 2
Sid Meier's Alpha Centauri	Street Fighter Alpha Anthology	Army of Two: The Devil's Cartel	Crysis 3
Blades of Steel	Ice Hockey	Superstar Ice Hockey	Hit the Ice	Slap Shot	NHL '94	NHL Stanley Cup	Pro Sport Hockey	Mutant League Hockey	Super Ice Hockey	2 on 2 Open Ice Challenge	Wayne Gretzky and the NHLPA All-Stars	NHL 96	NHL 97	NHL FaceOff 2003	NHL Hitz 2003	NHL 2004	NHL Hitz Pro	ESPN NHL 2K5	NHL 2005	NHL Eastside Hockey Manager	NHL 06	NHL 2K6	NHL Eastside Hockey Manager 2005	NHL 07	NHL 08	NHL 09	NHL 10	NHL 2K10	NHL 11	NHL Slapshot	NHL 12	NHL 13	NHL 14
Star Wars: The Empire Strikes Back	Star Wars: The Empire Strikes Back	Star Wars	Star Wars	Super Star Wars	Star Wars: Rebel Assault	Super Star Wars: The Empire Strikes Back	Super Star Wars: Return of the Jedi	Star Wars: Rebel Assault II: The Hidden Empire	Star Wars: Shadows of the Empire	Star Wars: Masters of Teräs Käsi	Star Wars: Yoda Stories	Star Wars Trilogy Arcade	Star Wars: Rebellion	Star Wars: Rogue Squadron	Star Wars: Episode I: Battle for Naboo	Star Wars Rogue Squadron II: Rogue Leader	Star Wars: Bounty Hunter	Star Wars Rogue Squadron III: Rebel Strike	Star Wars: Flight of the Falcon	Star Wars Trilogy: Apprentice of the Force	Star Wars: Battlefront	Star Wars: Battlefront II	Geneforge 4: Rebellion	Star Wars: Empire at War	Star Wars: Empire at War: Forces of Corruption	Star Wars: Lethal Alliance	Star Wars Battlefront: Renegade Squadron	Star Wars Battlefront: Elite Squadron
Nagagutsu o Haita Neko: Sekai Isshū 80 Nichi Dai Bōken	Valkyrie no Bōken: Toki no Kagi Densetsu	Dragon Wars	Tangled Tales: The Misadventures of a Wizard's Apprentice	Tales of Phantasia	Tales of Destiny	Tales of Eternia	Tales of the World: Narikiri Dungeon 2	Tales of Symphonia	Tales of the World: Summoner's Lineage	Venus & Braves	The Bard's Tale	Tales of Rebirth	Tales of Legendia	Tales of the Abyss	Tales of the World: Narikiri Dungeon 3	Tales of the Tempest	Tales of the World: Radiant Mythology	Eternal Sonata	Tales of Innocence	Tales of Hearts	Tales of Symphonia: Dawn of the New World	Tales of Vesperia	Blue Dragon: Awakened Shadow	Tales of Graces	Tales of the World: Radiant Mythology 2	Tales of VS.	Keroro RPG: Kishi to Musha to Densetsu no Kaizoku	Tales of Phantasia: Narikiri Dungeon X	Tales of Xillia	Tales of the Heroes: Twin Brave	Tales of the World: Dice Adventure	Tales of the World: Tactics Union	Tales of Xillia 2	Exstetra	Summon Night 5	Tales of Symphonia Chronicles
Roller Coaster	720°	Tiny Toon Adventures 2: Trouble in Wackyland	Theme Park	SimPark	Legoland	Rocket: Robot on Wheels	RollerCoaster Tycoon	Scooby-Doo! Mystery of the Fun Park Phantom	Theme Park World	The ClueFinders Search and Solve Adventures	Dave Mirra Freestyle BMX 2	Theme Park Inc	Universal Studios Theme Parks Adventure	RollerCoaster Tycoon 2	Nancy Drew: The Haunted Carousel	RollerCoaster Tycoon 3	Mall of America Tycoon	Thrillville	Tycoon City: New York	Chibi-Robo!: Park Patrol	Skate 3	Outlast	Zoo Tycoon	RollerCoaster Tycoon 4
Dance Aerobics	Magic Jewelry	Beatmania	Bust a Groove	Dance Dance Revolution	Beatmania IIDX	Dance Dance Revolution 2ndMix	Dance Dance Revolution 2ndMix Club Versions	Dance Dance Revolution 3rdMix	Dance Dance Revolution Solo 2000	Dance Dance Revolution: Best of Cool Dancers	Dancing Stage EuroMix	Drum Mania	EZ2DJ	Puyo Puyo DA!	Beatmania III	Dance Dance Revolution (Game Boy Color video games)	Dance Dance Revolution 4thMix	Dance Maniax	EZ2Dancer	The Jungle Book Groove Party	Keyboardmania	Para Para Paradise	Dance Dance Revolution (TV video games)	Dance Dance Revolution (Windows video games)	Dance Dance Revolution 5thMix	DDRMAX Dance Dance Revolution 6thMix	Beatmania IIDX 7th Style	Dance Dance Revolution Extreme	Dance Dance Revolution Konamix	Dancing Stage EuroMix 2	DDRMAX Dance Dance Revolution	DDRMAX2 Dance Dance Revolution 7thMix	Technicbeat	Beatmania IIDX 9th Style	Dance Dance Revolution Ultramix	Dancing Stage MegaMix	DDRMAX2 Dance Dance Revolution	Mojib-Ribbon	Dance Dance Revolution Extreme	Dancing Stage Fusion	DDR Festival Dance Dance Revolution	In the Groove	MC Groovz Dance Craze	Beatmania IIDX 12: Happy Sky	Dance Dance Revolution Extreme 2	Dance Dance Revolution Ultramix 3	Dance Praise	In the Groove 2	Beatmania	Beatmania IIDX 11 IIDXRED	Beatmania IIDX 13: Distorted	Dance Dance Revolution DVD Game	Dance Dance Revolution SuperNova	Dance Dance Revolution SuperNova	Dance Dance Revolution Ultramix 4	Dance Factory	DJMax Portable	Beatmania IIDX 14: Gold	Beatmania IIDX 15: DJ Troopers	Dance Dance Revolution Hottest Party	Dance Dance Revolution SuperNova 2	Dance Dance Revolution SuperNova 2	Dance Dance Revolution Universe	DJMax Portable 2	Beatmania IIDX 16: Empress	Dance Dance Revolution Hottest Party 2	Dance Dance Revolution Universe 3	Dance Dance Revolution X	DJMax Portable Black Square	DJMax Portable Clazziquai Edition	DJMax Technika	Jubeat	Song Summoner: The Unsung Heroes	Tap Tap Revenge	Beatmania IIDX 17: Sirius	Dance Dance Revolution Hottest Party 3	Dance Dance Revolution S	Dance Dance Revolution X2	DJ Max Fever	Leaf Trombone: World Stage	Beatmania IIDX 18 Resort Anthem	Dance Dance Revolution	Dance Dance Revolution	Dance Dance Revolution X2	Dance Evolution	DJMax Portable 3	DJMax Portable Hot Tunes	DJMax Technika 2	Hatsune Miku: Project DIVA Arcade	Reflec Beat	Dance Dance Revolution II	Dance Dance Revolution X3	DJMax Technika 3	Reflec Beat Limelight	DJMax Ray	DJMax Technika Tune	Reflec Beat Colette	Sound Voltex	Dance Dance Revolution	DJMax Technika Q
Auto Racing	Dragster	Rally-X	Car Wars	DONKEY.BAS	Freeway	Bump 'n' Jump	Grand Prix	Enduro	Spy Hunter	F-1 Race	Road Fighter	Turmoil	City Connection	Turbo Esprit	City Bomber	Continental Circus	Rad Racer	Famicom Grand Prix	Grand Prix Circuit	R.C. Pro-Am	Badlands	The Duel: Test Drive II	Hard Drivin'	Indianapolis 500: The Simulation	Days of Thunder	Nitro	Race Drivin'	Street Rod	Caesars Palace	Zero4 Champ DooZy-J Type-R	MegaRace	Ridge Racer	Top Gear 2	Cruis'n USA	Detroit	The Need for Speed	Destruction Derby	Fatal Racing	Hi-Octane	High Velocity	IndyCar Racing II	Ridge Racer Revolution	Top Gear 3000	Daytona USA: Championship Circuit Edition	Death Rally	MegaRace 2	Rage Racer	Scud Race	Sega Touring Car Championship	CART Precision Racing	Ignition	NASCAR 98	Need for Speed II	Planet of Death	Streets of SimCity	TOCA Touring Car Championship	Top Gear Rally	Touge: King the Spirits 2	Carmageddon II: Carpocalypse Now	Cro-Mag Rally	Daytona USA 2	DethKarz	Grand Prix Legends	Hot Wheels Stunt Track Driver	Need for Speed III: Hot Pursuit	R4: Ridge Racer Type 4	S.C.A.R.S.	TOCA 2 Touring Cars	Top Gear Overdrive	Viper Racing	C3 Racing	Demolition Racer	Gearhead Garage	Gran Turismo 2	Hot Wheels Turbo Racing	Lego Racers	Midtown Madness	Mobil 1 Rally Championship	Need for Speed: High Stakes	Racing Lagoon	Roadsters	Sports Car GT	Test Drive 6	Tokyo Xtreme Racer	Destruction Derby Raw	Dirt Track Racing	Dirt Track Racing: Sprint Cars	Driving Emotion Type-S	Metropolis Street Racer	Need for Speed: Porsche Unleashed	RC Revenge	Ridge Racer 64	Ridge Racer V	Rollcage Stage II	Stunt Racer 64	Test Drive 2001	Burnout	Car Battler Joe	Cruis'n Velocity	Europe Racer	Gran Turismo 3: A-Spec	GT Advance Championship Racing	Hot Wheels Extreme Racing	Lego Racers 2	Motor City Online	RC Revenge Pro	Rumble Racing	Wacky Races Starring Dastardly and Muttley	Auto Modellista	Battle Gear 3	Beam Breakers	Burnout 2: Point of Impact	Dirt Track Racing 2	Gadget Racers	GeneRally	Gran Turismo Concept	Hot Wheels Velocity X	Need for Speed: Hot Pursuit 2	Sega GT 2002	APEX	Drag Racer	GT Advance 3: Pro Concept Racing	Highway pursuit	The Italian Job	Live for Speed	Midnight Club II	Need for Speed: Underground	Project Gotham Racing 2	R: Racing Evolution	Street Legal Racing: Redline	Tokyo Xtreme Racer 3	TrackMania	FlatOut	Ford Racing 3	Gran Turismo 4	GT Racers	Need for Speed: Underground 2	RalliSport Challenge 2	Test Drive: Eve of Destruction	Xpand Rally	Alfa Romeo Racing Italiano	Battle Gear 4	Burnout Legends	Burnout Revenge	Enthusia Professional Racing	Forza Motorsport	GT Legends	GTR – FIA GT Racing Game	Juiced	L.A. Rush	Midnight Club 3: DUB Edition	Need for Speed: Most Wanted	Project Gotham Racing 3	Ridge Racer 6	Tokyo Xtreme Racer: Drift 2	Classic British Motor Racing	Corvette Evolution GT	Crashday	The Fast and the Furious	Ford Street Racing	Gran Turismo HD Concept	GTR 2 – FIA GT Racing Game	Import Tuner Challenge	LA Street Racing	Need for Speed: Carbon	NetKar Pro	OutRun 2006: Coast 2 Coast	Redline	Test Drive Unlimited	Cars Mater-National Championship	D1GP Arcade	Forza Motorsport 2	Gran Turismo 5 Prologue	Hot Wheels: Beat That!	Initial D Arcade Stage 4	Need for Speed: ProStreet	Race 07	Wangan Midnight	X Motor Racing	Yaris	Alarm für Cobra 11: Highway Nights	Asphalt 4: Elite Racing	Burning Wheels	Burnout Paradise	Chrysler Classic Racing	Ferrari Challenge: Trofeo Pirelli	GTI Club+: Rally Côte d'Azur	Midnight Club: Los Angeles	Speed Racer: The Videogame	Supersonic Acrobatic Rocket-Powered Battle-Cars	Asphalt 5	Cars Race-O-Rama	Forza Motorsport 3	Gran Turismo (PSP)	Need for Speed: Nitro	Need for Speed: Shift	Race or Die	Race Pro	Ridge Racer Accelerated	Wheelspin	Blur	Car Town	Gran Turismo 5	Hot Wheels Track Attack	Real Racing 2	Scrap Metal	The World of Cars Online	Asphalt 3D	Bang Bang Racing	Cars 2	Dirty Drivin'	DrawRace 2	Fast Beat Loop Racer	Forza Motorsport 4	GT Racing: Motor Academy	Need for Speed: The Run	Ridge Racer	Shift 2: Unleashed	Süpercan	Test Drive Unlimited 2	Asphalt 7: Heat	Dirt: Showdown	Forza Horizon	Test Drive: Ferrari Racing Legends	Asphalt 8: Airborne	Assetto Corsa	Forza Motorsport 5	Gran Turismo 6	Need for Speed Rivals	Real Racing 3	VS. Racing 2	Grid Autosport
