Expensive Planetarium	Lunar Lander	Trek73	Computer Bismarck	Protector	Dung Beetles	Sea Dragon	Capture The Flag	Gato	Jumpman	M.U.L.E.	NATO Commander	One on One: Dr. J vs. Larry Bird	Universe	Beyond Castle Wolfenstein	Brain Strainers	Carriers at War	Music Construction Set	Questron	Revenge of the Mutant Camels	Skyfox	Balance of Power	Castle Quest (BBC Micro)	Deathstar	Déjà Vu	Garry Kitchen's GameMaker	Koronis Rift	Mercenary	Moebius: The Orb of Celestial Harmony	The Pawn	Phantasie	Silent Service	Theatre Europe	Thexder	Winter Games	Annals of Rome	Brataccas	Defender of the Crown	Into the Eagle's Nest	Jewels of Darkness	Mean 18	Mind Walker	Portal (interactive novel)	Roadwar 2000	S.D.I.	Spindizzy	Starglider	Stryker's Run	Tass Times in Tonetown	Thrust	World Games	ALF: The First Adventure	Barbarian (Psygnosis)	Bonecruncher	Bubble Ghost	California Games	Dungeon Master	The Faery Tale Adventure	The King of Chicago	MIDI Maze	Nebulus	Sorcerer Lord	The Three Stooges	Wizball	Xconq	Zarch	Arcade Volleyball	Barbarian II: The Dungeon of Drax	The Colony	Dangerous Dave	Decisive Battles of the American Civil War Volume 1: Bull Run to Chancellorsville	Exile	Katakis	Pipeline	Rocket Ranger	Speedball	Starglider 2	Times of Lore	War in Middle Earth	Wasteland	Xenon	Zak McKracken and the Alien Mindbenders	Archipelagos	Ballistix	Chaos Strikes Back	Rick Dangerous	Garfield: Winter's Tail	Hillsfar	The Kristal	Populous	Project Firestart	Rings of Medusa	Shadow of the Beast	Space Rogue	Storm Across Europe	Sword of the Samurai	Waterloo	Xenon 2 Megablast	Captive	Centurion: Defender of Rome	Corporation	Crystals of Arborea	Fiendish Freddy's Big Top O'Fun	Hammerfist	Imperium	Ishido: The Way of Stones	MegaTraveller 1: The Zhodani Conspiracy	Solar Jetman: Hunt for the Golden Warpship	Star Control	Sword of Sodan	Turrican	Wings of Death	3D Construction Kit	Another World	Barbarian II	The Bard's Tale Construction Set	Fate: Gates of Dawn	Flames of Freedom	James Pond 2	Lethal Xcess	Populous II: Trials of the Olympian Gods	The Return of Medusa	3D Construction Kit II	Agony	Alcatraz	Amberstar	The Ancient Art of War in the Skies	Epic	Fire and Ice	Hoi AGA	Legends of Valour	Sensible Soccer	Zool	Ambermoon	Body Blows Galactic	Cannon Fodder	Jungle Strike	Mega Turrican	Perihelion: The Prophecy	Stardust	Syndicate	Zool 2	Arcade Pool	Cannon Fodder 2	Impossible Mission 2025	Putty Squad	Robinson's Requiem	Ruff 'n' Tumble	Super Skidmarks	Valhalla: Before the War	Alien Breed 3D II: The Killing Grounds	Beauty and the Beast (Commodore 64)	The Chaos Engine 2
Kangaroo	Jumanji (PC game)	Ape Escape	Monkey Puncher	Ape Escape 2	Pipo Saru 2001	Super Monkey Ball	Looney Tunes: Back in Action	Ape Escape: Pumped & Primed	Ape Escape 3	MiniMonos	Super Monkey Ball Deluxe	Super Monkey Ball Touch & Roll	Saru! Get You! Million Monkeys	Super Monkey Ball Adventure	Super Monkey Ball: Banana Blitz	Enslaved: Odyssey to the West
Mobile Suit Z Gundam: Hot Scramble	2nd Super Robot Wars	3rd Super Robot Wars	4th Super Robot Wars	Mobile Suit Gundam Side Story	Shin Kidō Senki Gundam Wing: Endless Duel	Gundam Side Story 0079: Rise from the Ashes	Super Robot Wars Alpha	Mobile Suit Gundam: Federation vs. Zeon	Mobile Suit Gundam: Journey to Jaburo	Mobile Suit Gundam: Zeonic Front	Super Robot Wars A	Super Robot Wars Alpha Gaiden	Mobile Suit Gundam: Lost War Chronicles	Super Robot Wars R	2nd Super Robot Wars Alpha	Mobile Suit Gundam: Encounters in Space	Super Robot Wars MX	3rd Super Robot Wars Alpha: To the End of the Galaxy	Another Century's Episode	Gundam Seed: Rengou vs. Z.A.F.T.	MS Saga: A New Dawn	Another Century's Episode 2	Kidō Senshi Gundam: Senjō no Kizuna	Mobile Suit Gundam Seed Destiny: Rengou vs. Z.A.F.T. II	Mobile Suit Gundam: Crossfire	Another Century's Episode 3: The Final	Dynasty Warriors: Gundam	Super Robot Wars W	Dynasty Warriors: Gundam 2	Mobile Ops: The One Year War	Mobile Suit Gundam 00	Mobile Suit Gundam: Gundam vs. Gundam	Mobile Suit Gundam: Gundam vs. Gundam Next	Dynasty Warriors: Gundam 3	Mobile Suit Gundam: Extreme Vs.	Mobile Suit Gundam AGE	Mobile Suit Gundam Unicorn
NCAA Basketball series	FIFA Football 2003	The Sims Online	FIFA Football 2004	FIFA Football 2005	Fight Night Round 3	College Hoops 2K8	NASCAR 08	NCAA Football 08	Skate	FaceBreaker	FIFA 09	Madden NFL 09	NASCAR 09	NCAA Football 09	Race Driver: Grid	Battlefield 1943	Boom Blox Bash Party	EA Sports Active	FIFA 10	FIFA Manager 10	Fight Night Round 4	EA Sports MMA	FIFA 11	NBA Jam	NCAA Football 11	Need for Speed: Hot Pursuit	Battlefield 3	FIFA 12	Tiger Woods PGA Tour 12	FIFA 13	FIFA Street	Grand Slam Tennis 2	Need for Speed: Most Wanted	FIFA 14	FIFA Manager 14	NCAA Football 14	MLB 14: The Show
SpongeBob SquarePants: Legend of the Lost Spatula	SpongeBob SquarePants: Operation Krabby Patty	SpongeBob SquarePants: SuperSponge	SpongeBob SquarePants: Employee of the Month	SpongeBob SquarePants: Revenge of the Flying Dutchman	SpongeBob SquarePants: Battle for Bikini Bottom	The SpongeBob SquarePants Movie	Nicktoons Unite!	Nicktoons: Battle for Volcano Island	SpongeBob SquarePants: Creature from the Krusty Krab	Nicktoons: Attack of the Toybots	SpongeBob SquarePants: Underpants Slam	SpongeBob's Atlantis SquarePantis	Drawn to Life: SpongeBob SquarePants Edition	SpongeBob SquarePants featuring Nicktoons: Globs of Doom	SpongeBob vs. The Big One: Beach Party Cook-Off	SpongeBob's Truth or Square	SpongeBob's Boating Bash	SpongeBob SquigglePants	SpongeBob Moves In	SpongeBob SquarePants: Plankton's Robotic Revenge
Chuck Rock	DinoCity	DinoPark Tycoon	Jurassic Park	Jurassic Park	Jurassic Park 2: The Chaos Continues	Jurassic Park: Rampage Edition	The Magic School Bus In the Time of the Dinosaurs	Saturn Bomberman	Jurassic Park: Chaos Island	The Lost World: Jurassic Park (console game)	Carnivores	Nanosaur	Carnivores 2	Dino Crisis	Warpath: Jurassic Park	Dino Crisis 2	Disney's Dinosaur	Jurassic Park III: Dino Defender	Dino Island	Dino Stalker	Star Fox Adventures	Jurassic Park: Operation Genesis	Dinosaur World	ParaWorld	Dinosaur King	Primeval Hunt	Turok	Carnivores: Dinosaur Hunter	Combat of Giants: Dinosaur Strike	Combat of Giants: Dinosaurs 3D	Jurassic Park: The Game	Primal Carnage
Wario Blast: Featuring Bomberman!	Wario Land: Super Mario Land 3	Virtual Boy Wario Land	Wario Land II	Wario Land 3	Wario Land 4	Wario World	WarioWare, Inc.: Mega Microgames!	WarioWare: Touched!	WarioWare: Twisted!	Wario: Master of Disguise	Wario Land: Shake It!	WarioWare: Snapped!
Ninja Hayate	The Legend of Kage	Ninja JaJaMaru-kun	Sega Ninja	The Last Ninja	Shinobi	Akakage	Bad Dudes Vs. DragonNinja	Last Ninja 2	Ninja Gaiden (arcade)	Ninja Spirit	The Ninja Warriors	Sanada Ten Braves	Wrath of the Black Manta	Ninja Crusaders	Shadow of the Ninja	Yo! Noid	The Legend of the Mystical Ninja	Ninja Combat	The G.G. Shinobi	The G.G. Shinobi II: The Silent Fury	Ninja Commando	Mystic Warriors	Shinobi III: Return of the Ninja Master	3 Ninjas Kick Back	The Ninja Warriors	Ninja Master's: Haō Ninpō Chō	Ayakashi Ninden Kunoichiban	Mystical Ninja Starring Goemon	Tenchu: Stealth Assassins	Ninja Assault	Tenchu 2: Birth of the Stealth Assassins	I-Ninja	Kung Fu Chaos	Naruto: Clash of Ninja	Tenchu: Wrath of Heaven	Azumi	N	Red Ninja: End of Honor	Shinobido: Way of the Ninja	Shinobido: Tales of the Ninja	Tenchu Z	The Legend of Kage 2	Ninjatown	Tenchu: Shadow Assassins	Mini Ninjas	Mark of the Ninja	Atomic Ninjas
Spyro the Dragon	Spyro 2: Ripto's Rage!	Spyro: Year of the Dragon	Spyro: Season of Ice	Spyro 2: Season of Flame	Spyro: Enter the Dragonfly	Spyro: Attack of the Rhynocs	Crash Bandicoot Purple: Ripto's Rampage and Spyro Orange: The Cortex Conspiracy	Spyro: A Hero's Tail	Spyro: Shadow Legacy	The Legend of Spyro: A New Beginning	The Legend of Spyro: The Eternal Night	The Legend of Spyro: Dawn of the Dragon	Skylanders: Spyro's Adventure
Make Trax	El-Fish	Freddi Fish	Odell Down Under	Itoi Shigesato no Bass Tsuri No. 1	The ClueFinders 5th Grade Adventures: The Secret of the Living Volcano	Ikachan	American Bass Challenge	Feeding Frenzy	Fish Tycoon	Shark Tale	Atlantis Sky Patrol	Feeding Frenzy 2: Shipwreck Showdown	Aqua Vita	Hidden Expedition	Mystery Case Files: Madame Fate	Mystery in London: On the Trail of Jack the Ripper	My Aquarium	Fish Tank	FishVille	Flux Family Secrets: The Rabbit Hole	Mystery Case Files: 13th Skull	Fez	Let's Fish! Hooked On	Mystery Case Files: Shadow Lake	Hero of Many	Ridiculous Fishing
Pokémon Red and Blue	Hey You, Pikachu!	Pokémon Yellow	Robopon Sun, Star, and Moon Versions	Metal Walker	Pokémon Gold and Silver	Pokémon Pinball	Pokémon Snap	Pokémon Stadium	Pokémon Crystal	Pokémon Puzzle Challenge	Pokémon Puzzle League	Pokémon Stadium 2	Robopon 2 Ring and Cross Versions	Pokémon Ruby and Sapphire	Pokémon Channel	Pokémon Colosseum	Pokémon Pinball: Ruby & Sapphire	Pokémon Dash	Pokémon Emerald	Pokémon FireRed and LeafGreen	Pokémon Mystery Dungeon: Blue Rescue Team and Red Rescue Team	Pokémon Trozei!	Pokémon XD: Gale of Darkness	Pokémate	Pokémon Battle Revolution	Pokémon Diamond and Pearl	Pokémon Ranger	Pokémon Mystery Dungeon: Explorers of Time and Explorers of Darkness	My Pokémon Ranch	Pokémon Platinum	Pokémon Ranger: Shadows of Almia	Pokémon HeartGold and SoulSilver	Pokémon Rumble	PokéPark Wii: Pikachu's Adventure	Pokémon Black and White	Pokémon Ranger: Guardian Signs	Learn with Pokémon: Typing Adventure	Pokémon Rumble Blast	Pokémon Conquest	Pokémon Mystery Dungeon: Gates to Infinity	Pokémon Rumble U	Pokémon X and Y	Pokemon Art Academy	Pokémon Battle Trozei
Arumana no Kiseki	First Queen	Kyrandia (Major BBS)	Dahna: Megami Tanjō	Stargate	Teenagent	Alundra	Beasts and Bumpkins	BS Tantei Club: Yuki ni Kieta Kako	Jade Cocoon: Story of the Tamamayu	The ClueFinders Math Adventures	Croc 2	Evergrace	Fatal Frame II: Crimson Butterfly	Tenchu: Fatal Shadows	Travian	Animal Crossing: Wild World	Drawn to Life	Folklore	Sangokushi Online	Hinterland	The Sims Castaway Stories	Siren: Blood Curse	Freesky Online	Harvest Moon: Hero of Leaf Valley	Mushroom Wars	Harvest Moon: A New Beginning	Samurai Taisen
Boulder Dash	Intellectual Decathlon	Combat School	The Goonies II	SRD: Super Real Darwin	The Colonel's Bequest	Master of Weapon	Mega Twins	The Dagger of Amon Ra	Kid Chameleon	Leisure Suit Larry 6: Shape Up or Slip Out!	ATP Tour Championship Tennis	Puzzle Bobble	Quarantine	Beavis and Butt-head in Virtual Stupidity	Icebreaker	Toy Story	Down in the Dumps	Monty Python & the Quest for the Holy Grail	CarnEvil	Poy Poy 2	Transformers: Beast Wars Transmetals	Virtua Tennis	Aidyn Chronicles: The First Mage	Fear Effect 2: Retro Helix	Moon Tycoon	Oddworld: Munch's Oddysee	Virtua Tennis 2	Crazy Taxi 3: High Roller	Freedom Force	Kakuto Chojin: Back Alley Brutal	Space Channel 5: Part 2	Unlimited Saga	1080° Avalanche	Anito: Defend a Land Enraged	Disney's Extreme Skate Adventure	Piglet's Big Game	TalesWeaver	Cubis 2	Second Sight	Sega Superstars	Down in Flames	Osu! Tatakae! Ouendan	Raze's Hell	C-evo	Tourist Trophy	Virtua Tennis 3	Genso Suikoden I & II	Alvin and the Chipmunks	The Darkness	Harry Potter and the Order of the Phoenix	Thrillville: Off the Rails	Captain Rainbow	Domain of Heroes	NHL 2K9	Emerald City Confidential	Harry Potter and the Half-Blood Prince	Osmos	Tomodachi Collection	Tony Hawk: Ride	Virtua Tennis 2009	MLB 10: The Show	NHL 2K11	Splatterhouse	Café 0 ~The Drowned Mermaid~	DC Universe Online	Madden NFL 12	Red Eclipse	SplitApple	Supremacy MMA	Virtua Tennis 4	X-Men: Destiny	Cannon Fodder 3	Lumines Electronic Symphony	Defiance	KickBeat	Star Wars: Tiny Death Star	War Thunder	Wargame: Red Dragon
Swashbuckler	Swordquest	Gladiator	Barbarian: The Ultimate Warrior	The Battle of Olympus	Keith Courage in Alpha Zones	Kenseiden	Samurai Warrior: The Battles of Usagi Yojimbo	Demon Sword	Lord of the Sword	Crystalis	Magic Sword	Realms of Arkania: Blade of Destiny	Sküljagger: Revolt of the Westicans	Darkmere	Edo no Kiba	Shining Force: The Sword of Hajya	Crusader of Centy	X-Kaliber 2097	Broken Sword: The Shadow of the Templars	Broken Sword II: The Smoking Mirror	Asura Blade: Sword of Dynasty	Bushido Blade 2	Die by the Sword	Maken X	Time Stalkers	Kengo	Warriors of Might and Magic	Severance: Blade of Darkness	Surveillance Kanshisha	Way of the Samurai	Alter Echo	Boktai 2: Solar Boy Django	The Legend of Zelda: Four Swords Adventures	Kingdom of Paradise	Kult: Heretic Kingdoms	Samurai Western	Broken Sword: The Angel of Death	Onechanbara: Bikini Samurai Squad	Samurai Champloo: Sidetracked	The City Beneath	Heavenly Sword	OneChanbara: Bikini Zombie Slayers	Akai Katana	The Legend of Zelda: Skyward Sword	Mount & Blade: With Fire & Sword	Superbrothers: Sword & Sworcery EP	Under Night In-Birth	Broken Sword 5: The Serpent's Curse	Malevolence: The Sword of Ahkranox	Blade Symphony
Sokoban	Popeye no Eigo Asobi	Impossible Mission	Scarabaeus	Revolution	Split Personalities	Alex Kidd: High-Tech World	The Fool's Errand	3 in Three	At the Carnival	Interphase	Mindtrap	Pipe Mania	Atomix	Challenge of the Ancient Empires!	Solstice: The Quest for the Staff of Demnos	Brat	Castle of Dr. Brain	D/Generation	Indiana Jones and the Last Crusade	Paganitzu	Spud's Adventure	Timequest	Kye	The 7th Guest	FlixMix	Mystery at the Museums	Return to Zork	Heartlight (game)	Chronomaster	Lights Out (game)	Logos Panic	Mario's Picross	Mario's Super Picross	9: The Last Resort	Clandestiny	Logical Journey of the Zoombinis	Milo	The Pandora Directive	The Time Warp of Dr. Brain	Uncle Henry's Playhouse	Marble Drop	Pikiinya!	Sutte Hakkun	Devil Dice	Nightfall	Puzz Loop	Spider and Web	Gruntz	Rubik's Games	Sonic the Hedgehog Pocket Adventure	Thomas & Friends: The Great Festival Adventure	Guru Logi Champ	The Messenger	Zoombinis Mountain Rescue	Samorost	Seiklus	Go! Sudoku	Polarium Advance	Smart Bomb	Voyage: Inspired by Jules Verne	Eets	PQ2: Practical Intelligence Quotient 2	Chocolate Castle	Crazy Machines 2	Neves	Picross DS	Prism: Light the Way	Professor Layton and the Curious Village	Professor Layton and the Diabolical Box	Switchball	Azada: Ancient Magic	Braid	Chronotron	Crosswords DS	Curse of the Pharaoh: The Quest for Nefertiti	Foldit	Professor Layton and the Mansion of the Deathly Mirror	Professor Layton and the Unwound Future	RHEM 3: The Secret Library	Steal Princess	Tag: The Power of Paint	Temporal	Violet	Cogs	Henry Hatsworth in the Puzzling Adventure	Numblast	Picross 3D	Professor Layton and the Last Specter	Scribblenauts	Hamlet	Majin and the Forsaken Kingdom	The Misadventures of P.B. Winterbottom	Nelson Tethers: Puzzle Agent	Phylo	Sherlock Holmes and the Mystery of Osborne House	Super Scribblenauts	The 7th Guest: Infection	Professor Layton and the Miracle Mask	Puzzle Agent 2	Q.U.B.E.	SpaceChem	Stacking	The Fool and His Money	Furmins	Pid	Quantum Conundrum	Vessel	Yesterday	Antichamber	Hundreds	Magrunner: Dark Pulse	Mario and Donkey Kong: Minis on the Move	Max: The Curse of Brotherhood	Professor Layton and the Azran Legacy	Blek (game)	Fract OSC
The Ancient Art of War	Laser Squad	Breach 2	Lost Patrol	Trevor McFur in the Crescent Galaxy	Zero Tolerance	Terra Nova: Strike Force Centauri	Incubation: Time Is Running Out	Warhammer 40,000: Chaos Gate	Crisis Zone	Ground Control	Hogs of War	Fallout Tactics: Brotherhood of Steel	Conflict: Desert Storm	Crimson Sea	Platoon	Red Faction II	Brute Force	Conflict: Desert Storm II	Army Men: Sarge's War	Breed	Conflict: Vietnam	Medal of Honor: Pacific Assault	Shellshock: Nam '67	Brothers in Arms: Earned in Blood	Star Wars: Republic Commando	ARMA: Armed Assault	The Outfit	BlackSite: Area 51	Bladestorm: The Hundred Years' War	Clive Barker's Jericho	Pursuit Force: Extreme Justice	SOCOM: U.S. Navy SEALs Tactical Strike	Battlefield: Bad Company	Fracture	Gunrox	Savage 2: A Tortured Soul	The Sky Crawlers: Innocent Aces	Jet Fighters	Modern Combat: Sandstorm	Operation Flashpoint: Dragon Rising	Warhammer 40,000: Dawn of War II	Battlefield: Bad Company 2	Clone Wars Adventures	Mass Effect 2	Modern Combat 2: Black Pegasus	Warhammer 40,000: Dawn of War II – Chaos Rising	Operation Flashpoint: Red River	Warhammer 40,000: Space Marine	Gears of War: Judgment	Scourge: Outbreak	Men of War: Assault Squad 2
Jack the Giantkiller	Jet-Boot Jack	Mighty Bomb Jack	Moonmist	Rupert and the Ice Castle	The 3-D Battles of WorldRunner	Jack the Nipper II: In Coconut Capers	Armored Police Metal Jack	Alone in the Dark 2	Cool World	SOS	Bermuda Syndrome	Dark Seed II	Guilty	Jack Bros.	Disruptor	Chameleon Twist 2	Treasures of the Deep	Nox	Headhunter	Dead to Rights	Robotech: Battlecry	Chicago 1930	Contract J.A.C.K.	Headhunter Redemption	In Memoriam	Far Cry	The Nightmare Before Christmas: Oogie's Revenge	Samurai Jack: The Shadow of Aku	Call of Cthulhu: Dark Corners of the Earth	Far Cry Instincts	The Nightmare Before Christmas: The Pumpkin King	Peter Jackson's King Kong: The Official Game of the Movie	Radiata Stories	Pirates of the Caribbean: The Legend of Jack Sparrow	BioShock	Jack Keane	Pirates of the Caribbean: At World's End	Art of Murder: Hunt for the Puppeteer	Lost: Via Domus	Damnation	MadWorld	Dead to Rights: Retribution	Puss in Boots	Anarchy Reigns
Frogs and Flies	Up'n Down	Hyper Sports	Shao-lin's Road	Tag Team Match: MUSCLE	Captured	Ghost House	Trojan	Airball	Mutant Night	Konami '88	P.O.W.: Prisoners of War	Snoopy's Silly Sports Spectacular	Code Name: Viper	The Cyber Shinobi	Dragon Fighter	Street Fighter 2010: The Final Fight	Smart Ball	Olympic Gold	Road Runner's Death Valley Rally	Steg	3 Count Bout	Super Back to the Future II	Numan Athletics	SegaSonic the Hedgehog	Decathlete	Denjinmakai	Astal	Olympic Summer Games	Osman	Chameleon Twist	Strider 2	Freekstyle	Athens 2004	Yetisports	Keroro Gunso: Enshū da Yo! Zenin Shūgō	Over the Hedge	Pippa Funnell: Take the Reins	Bolt	AaaaaAAaaaAAAaaAAAAaAAAAA!!! – A Reckless Disregard for Gravity	Pallurikio	GoatUp
Zombi	Zombie Nation	Corpse Killer	They Hunger	The Typing of the Dead	Zombie Revenge	Nightmare Creatures II	The House of the Dead III	Voodoo Vince	Survival Crisis Z	The House of the Dead 4	Land of the Dead: Road to Fiddler's Green	Stubbs the Zombie in Rebel Without a Pulse	Urban Dead	Dead Rising	Touch the Dead	Zombie Panic! Source	Corpse Craft: Incident at Weardd Academy	Counter-Strike Online	Dead Frontier	Burn Zombie Burn	Call of Duty: Zombies	Dead Rising: Chop Till You Drop	Plants vs. Zombies	Zombie Apocalypse	Zombie Driver	Zombie Tycoon	Blacklight: Tango Down	Blood Drive	Call of Duty: Black Ops	Dead Nation	Dead Rising 2	Pixel Force: Left 4 Dead	Red Dead Redemption: Undead Nightmare	Atom Zombie Smasher	Call of Duty: Black Ops – Zombies	Dead Block	Dead Island	Dead Rising 2: Off the Record	Zombie Gunship	Zombie Lane	Zombies	Call of Duty: Black Ops II	Lollipop Chainsaw	The Sims 3: Supernatural	Zombies, Run!	Dead Effect	Dead Island: Riptide	Dead Rising 3	How to Survive	Mob of the Dead	Plants vs. Zombies 2: It's About Time	State of Decay
A View to a Kill	Police Quest: In Pursuit of the Death Angel	Police Quest II: The Vengeance	Harpoon	James Pond	James Bond Jr.	James Bond 007: The Duel	GoldenEye 007	James Bond 007	Tomorrow Never Dies	007 Racing	The World Is Not Enough	007: Agent Under Fire	James Bond 007: Nightfire	James Bond 007: Everything or Nothing	GoldenEye: Rogue Agent	007: From Russia with Love	Naruto: The Broken Bond	007: Quantum of Solace	GoldenEye 007	James Bond 007: Blood Stone	007 Legends
Crystal Castles	Treasure Cove!	Xixit	Marvel Super Heroes: War of the Gems	Purikura Daisakusen	Super Puzzle Fighter II Turbo	Puchi Carat	Bejeweled	Warblade	Bejeweled 2	Marble Blast Ultra	Mushihimesama Futari	Bejeweled Twist	Bejeweled 3	Bejeweled Blitz	My Little Pony: Friendship Is Magic
Check Man	Adventure Construction Set	Rollaround	Mendel Palace	Freakin' Funky Fuzzballs	Super Glove Ball	Egypt	Super Skweek	Blob	Spelling Jungle	No One Can Stop Mr. Domino!	Bookworm	Dungeon Scroll	Kotoba no Puzzle: Mojipittan	Word Up	Jewel Quest	Polarium	Bonnie's Bookstore	Chuzzle	Bookworm Adventures	Konductra	Talismania	Hexic 2	Puzzle Quest: Challenge of the Warlords	RPG Maker VX	Sujin Taisen: Number Battles	Bananagrams (online game)	Fishdom	Bloody Fun Day	Puzzle Quest: Galactrix	Words with Friends	Triple Town	Word Worm	10000000	Scramble with Friends	2048	Threes!
Golf	Leaderboard	Jack Nicklaus' Greatest 18 Holes of Major Championship Golf	Arnold Palmer Tournament Golf	Golfamania	Major Title	Hal's Hole in One Golf	NES Open Tournament Golf	Mecarobot Golf	True Golf Classics: Wicked 18	The Simpsons: Itchy & Scratchy in Miniature Golf Madness	Golf (Virtual Boy)	Neo Turf Masters	British Open Championship Golf	Jack Nicklaus 4	Masters '98: Haruka Naru Augusta	Mario Golf	Disney Golf	Outlaw Golf	Sid Meier's SimGolf	Swingerz Golf	Everybody's Golf 4	Mario Golf: Toadstool Tour	Mario Golf: Advance Tour	Tiger Woods PGA Tour 06	True Swing Golf	Over the Hedge: Hammy Goes Nuts!	Super Swing Golf	Tiger Woods PGA Tour 07	Aqua Teen Hunger Force Zombie Ninja Pro-Am	Everybody's Golf 5	Super Swing Golf: Season 2	Tiger Woods PGA Tour 08	Summer Sports: Paradise Island	Tiger Woods PGA Tour 09	World Golf Tour	Tiger Woods PGA Tour 10	Tiger Woods PGA Tour 11	Everybody's Golf 6	Kinect Sports: Season Two	Tiger Woods PGA Tour 14	Mario Golf: World Tour
Digimon World 2	Digimon Adventure: Anode/Cathode Tamer	Digimon World	Digimon Adventure 02: Tag Tamers	Digimon Battle Spirit	Digimon Battle Online	Digimon Tamers: Battle Spirit Ver. 1.5	Digimon Racing	Digimon Rumble Arena 2	Digimon World 4	Digimon World Data Squad	Digimon World DS	Digimon World Dawn and Dusk	Digimon Masters	Digimon Fusion	Digimon World Re:Digitize	Digimon Adventure
Batman: The Video Game	Batman	Batman Forever	Batman Beyond: Return of the Joker	Batman: Vengeance	Batman: Dark Tomorrow	Batman: Rise of Sin Tzu	Batman Begins	Lego Batman: The Videogame	Batman: Arkham Asylum	Batman: The Brave and the Bold – The Videogame	Batman: Arkham City	Batman: Arkham City Lockdown	Gotham City Impostors	Lego Batman 2: DC Super Heroes	Batman	Batman: Arkham Origins	Batman: Arkham Origins (mobile)	Batman: Arkham Origins Blackgate
Pac-Man	Hangly-Man	Kick	Munchkin	Munchman (tabletop electronic game)	Baby Pac-Man	Ms. Pac-Man	Munch Man	Pac-Man (Atari 2600)	Pac-Man Plus	Super Pac-Man	Jr. Pac-Man	Professor Pac-Man	Pac & Pal	Pac-Land	Pac-Mania	Pac-Attack	Pac-In-Time	Pac-Man 2: The New Adventures	Pac-Man Arrangement	Pac-Man World	Ms. Pac-Man Maze Madness	Pac-Man: Adventures in Time	Pac-Man Collection	Pac-Man World 2	Pac-Man Vs.	He-Man: Defender of Grayskull	Pac 'n Roll	Pac-Man Pinball Advance	Pac-Man World 3	Pac-Pix	Pac-Man World Rally	Pac-Man Championship Edition	Pac-Man Championship Edition DX	Pac-Man Party	Pac-Man Battle Royale	World's Biggest Pac-Man	Pac-Man & Galaga Dimensions	He-Man: The Most Powerful Game in the Universe	Pac-Man and the Ghostly Adventures
Storm Warrior	Dark Ages	Niji no Silkroad	Kaeru no Tame ni Kane wa Naru	Valis IV	Prince of Persia 2: The Shadow and the Flame	Shining Force CD	The Elder Scrolls Adventures: Redguard	Prince of Persia 3D	Robin Hood: The Legend of Sherwood	Prince of Persia: The Sands of Time	Robin Hood: Defender of the Crown	Prince of Persia: Warrior Within	Battles of Prince of Persia	Prince of Persia: The Two Thrones	Suikoden V	Prince of Persia	Prince of Persia: The Fallen King	Princess Debut	Prince of Persia: The Forgotten Sands	Prince of Persia: The Forgotten Sands (Wii)	Blackwater
Crush, Crumble and Chomp!	Venture	Escape	Felix and the Fruit Monsters	Do! Run Run	Eggerland Mystery	Nightshade	Rampage	Godzilla: Monster of Monsters	Hanjuku Hero	Godzilla (Game Boy)	King of the Monsters	Master of Monsters	SkiFree	Godzilla 2: War of the Monsters	Firestriker	Super Godzilla	Awesome Animated Monster Maker	Down the World: Mervil's Ambition	Godzilla: Monster War	Monster World IV	Mystic Towers	The Ultimate Haunted House	Aaahh!!! Real Monsters	Frankenstein: Through the Eyes of the Monster	RPG Tsukūru: Super Dante	Azure Dreams	Rampage World Tour	Dragon Warrior Monsters	Godzilla Generations	Monster Rancher 2	Muppet Monster Adventure	Rampage Through Time	Dokapon	Dragon Warrior Monsters 2	Monster Rancher 3	Monsters, Inc. Scream Team	Godzilla: Destroy All Monsters Melee	Monster Rancher 4	War of the Monsters	Amazing Island	Godzilla: Save the Earth	Gurumin: A Monstrous Adventure	Journey to Rooted Hold	Monster Rancher EVO	Tao's Adventure: Curse of the Demon Seal	Dragon Quest Monsters: Joker	Monster Hunter 2	Monster Kingdom: Jewel Summoner	Godzilla: Unleashed	Monster Rancher DS	Shin Megami Tensei: Devil Summoner 2: Raidou Kuzunoha vs. King Abaddon	What Did I Do To Deserve This, My Lord? 2	Gyromancer	Crystal Monsters	Dragon Quest Monsters: Joker 2	Kingdom Conquest	Lord of Arcana	Monster Jam: Path of Destruction	Sesame Street: Once Upon a Monster	Hell Yeah! Wrath of the Dead Rabbit	Papo & Yo	Moero Chronicle
Goal!	Tecmo Cup Soccer Game	World Championship Soccer	Football Champ	Kenny Dalglish Soccer Match	Nintendo World Cup	Super Soccer	World League Soccer	European Club Soccer	Goal! Two	Konami Hyper Soccer	Striker	Pro Moves Soccer	Soccer Kid	Tecmo Cup Football Game	Ultimate Soccer	Captain Tsubasa 5: Hasha no Shōgō Campione	Dino Dini's Soccer	Hat Trick Hero 2	Taito Power Goal	International Superstar Soccer Deluxe	Super Formation Soccer 95: della Serie A	International Superstar Soccer 64	Backyard Soccer MLS Edition	FIFA Football 2002	Go! Go! Beckham! Adventure on Soccer Island	Super Shot Soccer	Inazuma Eleven	Academy of Champions: Soccer	Inazuma Eleven 2	Inazuma Eleven 3	Inazuma Eleven GO	Inazuma Eleven GO 2: Chrono Stone	Inazuma Eleven GO 3: Galaxy
