The Return of Heracles	H.E.R.O.	Golden Axe Warrior	Menace Beach	Skate or Die 2: The Search for Double Trouble	Fatal Labyrinth	Radia Senki: Reimeihen	Rent-A-Hero	Black Crypt	Hero's Heart (Windows)	Heros: The Sanguine Seven	Romancing SaGa 2	Heroes of Might and Magic II	Gates of Skeldal	Heroes of Might and Magic III: Armageddon's Blade	Heroes of Might and Magic III	The Legend of Heroes III: Song of the Ocean	Heroes of Might and Magic III: The Shadow of Death	Majesty: The Fantasy Kingdom Sim	Siege of Avalon	Gothic II	Heroes of Might and Magic IV	Klonoa Heroes: Densetsu no Star Medal	Neverwinter Nights: Shadows of Undrentide	Custom Robo (Nintendo GameCube)	Fable	The Lord of the Rings: The Third Age (GBA)	Suikoden IV	Gauntlet: Seven Sorrows	MediEvil: Resurrection	Gothic 3	Guild Wars Nightfall	Heroes of Might and Magic V	What Did I Do to Deserve This, My Lord?	Fable II	Heroes of Might and Magic Online	Drawn to Life: The Next Chapter	Final Fantasy Crystal Chronicles: Echoes of Time	Half-Minute Hero	Thracia	Hero Core	Heroes of Newerth	Red Steel 2	Darkspore	Dragon Fantasy	Dungeons & Dragons: Daggerdale	PlayStation Move Heroes	Trine 2	Might & Magic Heroes VI	Heroes of Ruin	Marvel: Avengers Alliance	Prime World
Power Pad	Jambo! Safari	Mario Power Tennis	Ten Pin Alley 2	Anubis II	Escape from Bug Island	Far Cry Vengeance	GT Pro Series	The Legend of Zelda: Twilight Princess	Rockstar Games presents Table Tennis	Ultimate Duck Hunting	WarioWare: Smooth Moves	Wii Play	Wii Sports	Avatar: The Last Airbender – The Burning Earth	Brunswick Pro Bowling	Carnival Games	The Dog Island	Dokapon Kingdom	Donkey Kong Barrel Blast	Game Party	Heatseeker	Heavenly Guardian	Link's Crossbow Training	Mario & Sonic at the Olympic Games	Mario Strikers Charged	No More Heroes	Resident Evil: The Umbrella Chronicles	Samurai Warriors: Katana	Wii Fit	AMF Bowling World Lanes	Big Beach Sports	Brothers in Arms: Double Time	Disaster: Day of Crisis	Emergency Mayhem	Hasbro Family Game Night	Jillian Michaels' Fitness Ultimatum 2009	Mario Kart Wii	Mugen Puchipuchi	Nitrobike	Personal Trainer: Walking	Pinball Hall of Fame: The Williams Collection	Pong Toss! Frat Party Games	Shaun White Snowboarding	Skate It	We Ski	Gallop & Ride	Brave: A Warrior's Tale	Dead Space: Extraction	Gravitronix	Horrible Histories: Ruthless Romans	Ju-on: The Grudge	Major Minor's Majestic March	Neighborhood Games	Rabbids Go Home	Rock N’ Roll Climber	Spectrobes: Origins	Spyborgs	WarioWare D.I.Y.	Wii Fit Plus	Wii Sports Resort	Your Shape	Doctor Who: Evacuation Earth	Doctor Who: Return to Earth	FlingSmash	Flip's Twisted World	No More Heroes: Heroes' Paradise	UDraw Pictionary	UDraw Studio	Super Monkey Ball: Step & Roll	AFL (Wii)	Disney Princess: Enchanting Storybooks	Fishing Resort	Madden NFL Football	Phineas and Ferb: Across the 2nd Dimension	Wii Play: Motion	Nintendo Land	Wii Fit U	Wii Sports Club
The Oregon Trail	Hunt the Wumpus	Maze War	Colossal Cave Adventure	The Cottage	BASIC Programming	Lords of Karma	The Prisoner	Windfall: The Oil Crisis Game	Beagle Bag	Rocky's Boots	Business Games	Gossip	Kawasaki Synthesizer	Snipes	Twin Kingdom Valley	Donald Duck's Playground	Heart of Africa	Alter Ego	Painterboy	Scarab of Ra	Trust & Betrayal: The Legacy of Siboot	The Money Game	Bakushou!! Jinsei Gekijou	Minesweeper	Rasāru Ishii no Childs Quest	Wall Street Kid	Bakushō! Star Monomane Shitennō	Covert Action	Jones in the Fast Lane	Microsoft Minesweeper	Game-Maker	Mad TV	Nibbles	Mouse Practice	Leading Company	Commander Blood	JumpStart 1st Grade	Storybook Weaver	Twisted: The Game Show	Junior Field Trips	Super Okuman Chouja Game	The Amazon Trail	JumpStart 2nd Grade	JumpStart Adventures 4th Grade: Haunted Island	Madeline European Adventures	Mortimer and the Riddles of the Medallion	Tower Dream	Carmen Sandiego's Great Chase Through Time	Dilbert's Desktop Games	JumpStart Adventures 5th Grade: Jo Hammet, Kid Detective	JumpStart Typing	Microsoft Entertainment Pack: The Puzzle Collection	Blue's Birthday Adventure	The ClueFinders 4th Grade Adventures: Puzzle of the Pyramid	Horseland	Sim RPG Maker	The ClueFinders 6th Grade Adventures: The Empire of the Plant People	The ClueFinders Reading Adventures	JumpStart Adventures 4th Grade: Sapphire Falls	RPG Maker 2000	The ClueFinders: The Incredible Toy Store Adventure!	Icy Tower	JumpStart SpyMasters: Unmask the Prankster	The ClueFinders: Mystery Mansion Arcade	JumpStart Advanced 1st Grade	Lemonade Tycoon	RPG Maker 2	Toontown Online	RPG Maker XP	Yourself!Fitness	Bliss	Homeland	Purble Place	Touch Dictionary	Kudos	Thomas & Friends merchandise	My French Coach and My Spanish Coach	Let's Play Mums	Let's Play Schools	My Japanese Coach	My Weight Loss Coach	Xi (alternate reality game)	Cow Clicker	Smart As	Cookie Clicker	Driftmoon
Obsidian	Hell: A Cyberpunk Thriller	BioForge	The Dig	Torin's Passage	Drowned God	Jonny Quest: Cover-Up at Roswell	Orion Burger	OverBlood	Phantasmagoria: A Puzzle of Flesh	Atlantis: The Lost Tales	Sanitarium	Atlantis II	Indiana Jones and the Infernal Machine	Ring	Star Trek: Hidden Evil	Chicken Run	Daria's Inferno	In Cold Blood	Le Bizzarre Avventure di GioGio: Vento Aureo	Resident Evil Zero	Sherlock Holmes: The Mystery of the Mummy	Dark Fall	Broken Sword: The Sleeping Dragon	Lifeline	Dark Fall II: Lights Out	Lemony Snicket's A Series of Unfortunate Events	Silent Hill 4: The Room	Agatha Christie: And Then There Were None	Another Code: Two Memories	Echo: Secrets of the Lost Cavern	Lula 3D	Nibiru: Age of Secrets	Barrow Hill	The Da Vinci Code	Diamond Crush	Keepsake	Tony Tough 2: A Rake's Progress	Undercover: Operation Wintersun	Ankh: Battle of the Gods	Ghost in the Sheet	Hotel Dusk: Room 215	Mondo Medicals	Penumbra: Overture	Silent Hill: Orphan	Chronicles of Mystery: The Scorpio Ritual	Elebits: The Adventures of Kai and Zero	Penumbra: Black Plague	Penumbra: Requiem	Rhiannon: Curse of the Four Branches	The Book of Unwritten Tales	Broken Sword: The Shadow of the Templars – Director's Cut	Dark Fall: Lost Souls	LostWinds 2: Winter of the Melodias	Mais où se Cache Carmen Sandiego? Mystère au Bout du Monde	Nine Hours, Nine Persons, Nine Doors	The Whispered World	Alice in Wonderland	Dead Space Ignition	Gray Matter	Saw II: Flesh & Blood	Dream:scape	Gemini Rue	Hysteria Project 2	Metal Dead	Phantasmat	Sissy's Magical Ponycorn Adventure	Trauma	Anna	Deponia	Resonance	Scribblenauts Unlimited	Silent Hill: Book of Memories	Deadfall Adventures	Dracula 4: The Shadow of the Dragon	Mimpi	The Swapper	Year Walk
Mystery House	Softporn Adventure	Escape from Rungistan	The Hobbit	The Coveted Mirror	Earthly Delights	Crypt of Medea	Erik the Viking	Fahrenheit 451	Nine Princes in Amber	Knight Orc	Leisure Suit Larry in the Land of the Lounge Lizards	Mixed-Up Mother Goose	Shadowgate	Deja Vu II: Lost in Las Vegas	Leisure Suit Larry Goes Looking for Love (in Several Wrong Places)	Mars Saga	Neuromancer	ALF	Codename: ICEMAN	Hoyle's Official Book of Games	Indiana Jones and the Last Crusade: The Graphic Adventure	Leisure Suit Larry III: Passionate Patti in Pursuit of the Pulsating Pectorals	Mean Streets	Space Quest III	Who Framed Roger Rabbit	Maupiti Island (game)	Conquests of the Longbow: The Legend of Robin Hood	Heart of China	Leisure Suit Larry 5: Passionate Patti Does a Little Undercover Work	Martian Memorandum	Space Quest IV	Curse of Enchantia	Dark Seed	Indiana Jones and the Fate of Atlantis	KGB	King's Quest VI	The Legend of Kyrandia	Lure of the Temptress	Waxworks	Dare to Dream	Gabriel Knight: Sins of the Fathers	Day of the Tentacle	Police Quest: Open Season	Richard Scarry's Busytown	Beneath a Steel Sky	DreamWeb	Under a Killing Moon	Universe	Blue Ice	Discworld	Highlander: The Last of the MacLeods	Phantasmagoria	Prisoner of Ice	Shivers	Space Quest 6	Discworld II: Missing Presumed...!?	Indiana Jones and His Desktop Adventures	Leisure Suit Larry: Love for Sail!	Rama	The Sacred Mirror of Kofun	The Feeble Files	Morpheus	Tex Murphy: Overseer	Simon the Sorcerer 3D	The Adventures of Fatman	Apprentice	Leisure Suit Larry: Magna Cum Laude	Winnie the Pooh's Rumbly Tumbly Adventure	Al Emmo and the Lost Dutchman's Mine	Runaway 2: The Dream of the Turtle	The Shivah	Limbo of the Lost	Nelly Cootalot: Spoonbeaks Ahoy!	The Secrets of Atlantis: The Sacred Legacy	Insecticide	A Second Face	Doctor Lautrec and the Forgotten Knights	Indiana Jones Adventure World	Space Quest: Vohaul Strikes Back	Cypher	Edna & Harvey: Harvey’s New Eyes
Radical Dreamers	Timeslaughter	Ever 17: The Out of Infinity	The Ant Bully	I Wanna Be the Guy
Galaxian	Galaga	Dig Dug	Xevious	Libble Rabble	The Tower of Druaga	Dig Dug II	Metro-Cross	Sky Kid	Genpei Tōma Den	Rolling Thunder	Toy Pop	Dragon Spirit	Wonder Momo	Bravoman	Starblade	Namco Classic Collection Vol. 1	Time Crisis: Project Titan	Katamari Damacy	Namco Museum Battle Collection	Beautiful Katamari	Katamari Damacy Mobile	Namco Museum DS	Namco Museum Remix	I Love Katamari	Galaga Remix (iOS)	Time Crisis: Razing Storm	Go Vacation	Katamari Amore
Monopoly (video games)	Die Hard Trilogy	Ribbit King	Agassi Tennis Generation	BMX XXX	Minority Report: Everybody Runs	Mystic Heroes	Salt Lake 2002	Barbie Horse Adventures: Wild Horse Rescue	Cabela's Dangerous Hunts	Curse: The Eye of Isis	The Great Escape	Vietcong	Wallace & Gromit in Project Zoo	The Guy Game	Midway Arcade Treasures 2	Terminator 3: The Redemption	Æon Flux	Greg Hastings Tournament Paintball MAX'D	Ninjabread Man	Wallace & Gromit: The Curse of the Were-Rabbit	Bad Day L.A.	Biker Mice from Mars	Eragon	Flushed Away	Happy Feet	Just Cause	Made Man	Secret Files: Tunguska	Taito Legends 2	Xyanide	Beowulf: The Game	Buzz! Junior: Robo Jam	The Golden Compass	High School Musical: Sing It!	The History Channel: Battle for the Pacific	Hour of Victory	Ratatouille	The Red Star	Shrek the Third	TMNT	Tony Hawk's Proving Ground	Alone in the Dark	Buzz! Junior: Dino Den	The Chronicles of Narnia: Prince Caspian	The Mummy: Tomb of the Dragon Emperor	Order Up!	Secret Service	WALL-E	You're in the Movies	Astro Boy: The Video Game	Fairytale Fights	G.I. Joe: The Rise of Cobra	Indiana Jones and the Staff of Kings	Leisure Suit Larry: Box Office Bust	Monsters vs. Aliens	Phineas and Ferb	The Punisher: No Mercy	Stalin vs. Martians	Stoked	Toy Story Mania!	Watchmen: The End Is Nigh	Wheelman	Legend of the Guardians: The Owls of Ga'Hoole	The Lord of the Rings: Aragorn's Quest	Ninety-Nine Nights II	Prison Break: The Conspiracy	Tangled: The Video Game	Toy Story 3: The Video Game	Tron Evolution: Battle Grids	Tron: Evolution	Vancouver 2010	Bodycount	Moon Diver	Thor: God of Thunder	FlatOut 3: Chaos & Destruction	Battleship	Family Guy: Back to the Multiverse	London 2012	Rambo: The Video Game
Golden Gate Killer	CSI: Crime Scene Investigation	CSI: Dark Motives	CSI: Miami	CSI: 3 Dimensions of Murder	CSI: Hard Evidence	CSI: NY	CSI: Deadly Intent	CSI: Fatal Conspiracy
Vulgus	Talisman	Street Fighter	Strider (arcade game)	Captain Commando	Street Fighter II: The World Warrior	Super Ghouls 'n Ghosts	Street Fighter II Turbo: Hyper Fighting	Super Street Fighter II	X-Men: Children of the Atom	Marvel Super Heroes	Red Earth	Rival Schools: United by Fate	Street Fighter Collection	Street Fighter III: 2nd Impact	JoJo's Bizarre Adventure	Marvel vs. Capcom: Clash of Super Heroes	Final Fight Revenge	SNK vs. Capcom: The Match of the Millennium	Street Fighter III: 3rd Strike	Capcom vs. SNK: Millennium Fight 2000	Cannon Spike	Marvel vs. Capcom 2: New Age of Heroes	Capcom vs. SNK 2	Hyper Street Fighter II	P.N.03	Street Fighter Anniversary Collection	Capcom Classics Collection	Devil Kings	Harvey Birdman: Attorney at Law	Street Fighter IV	Street Fighter Online: Mouse Generation	Super Street Fighter II Turbo HD Remix	Tatsunoko vs. Capcom: Ultimate All-Stars	Dark Void Zero	Super Street Fighter IV: Arcade Edition	Marvel vs. Capcom 3: Fate of Two Worlds	Super Street Fighter IV: 3D Edition	Ultimate Marvel vs. Capcom 3	Marvel vs. Capcom Origins	Street Fighter X Tekken	Darkstalkers Resurrection	Strider
Amidar	Apple Panic	Lady Bug	Space Dungeon	Alien Garden	Aztec	Aztec Challenge	Escape from the Mindmaster	Felix in the Factory	Miner 2049er	Necromancer	Raiders of the Lost Ark	Big Top	Binary Land	Chack'n Pop	Dino Eggs	Flappy	Hard Hat Mack	Killer Gorilla	Lode Runner	Mountain King	Pharaoh's Curse	Pogo Joe	Tunnel Runner	The Castles of Dr. Creep	Cheyenne	Circus Charlie	Conan: Hall of Volta	Daredevil Dennis	Fruity Frank	Hover Bovver	Lazy Jones	Magical Tree	Montezuma's Revenge	Space Taxi	Trashman	Challenger	Citadel	The Fairyland Story	Gribbly's Day Out	I'm Sorry	Ikki	Indiana Jones and the Temple of Doom	Repton	Rupert and the Toymaker's Party	Willy the Worm	Atlantis no Nazo	Banana	Penguin Adventure	The Sentinel	Tōkaidō Gojūsan-tsugi	Uuno Turhapuro muuttaa maalle	Marksman Shooting & Trap Shooting	Arkanoid: Revenge of Doh	Demon Stalkers	Emerald Mine	Hi no Tori Hououhen: Gaou no Bouken	Proof of Destruction	Captain Comic	Herbert	Avoid the Noid	Camelot	Catacomb	Chip's Challenge	Indiana Jones and the Last Crusade: The Action Game	Motocross Maniacs	Twinworld	Adventures of Lolo 3	Cadaver	Captain Comic II: Fractured Reality	Chip 'n Dale Rescue Rangers: The Adventures in Nimnul's Castle	Dragon Crystal	Dragon's Lair (Nintendo Entertainment System)	DuckTales: The Quest for Gold	E-Motion	Flimbo's Quest	Flood	Moai Kun	Oxyd	Pitman	Pyro 2	Snow Bros	Starch (game)	Treasure Mountain!	Crystal Caves	Gauntlet III: The Final Quest	Magic Pockets	Rattler Race	Spanky's Quest	Supaplex	Tranquility	Where's Waldo?	Yume Penguin Monogatari	Crazy Sue Goes On	Harlequin	Pushover	Putty	Risky Woods	Secret Agent	Super Hunchback	Treasure MathStorm!	Wizkid	Word Rescue	Aero the Acro-Bat	Arabian Nights	Bio Menace	Blake Stone: Aliens of Gold	Citadel 2	Cool Spot	Cool World	Fury of the Furries	James Pond 3: Operation Starfish	Jetpack	The Last Eichhof	Monster Bash	Mr. Nutz	Out to Lunch	Prehistorik 2	Puggsy	Sleepwalker	Superfrog	Sylvester and Tweety in Cagey Capers	Traps 'n' Treasures	Xargon	Barney's Hide & Seek Game	Animaniacs	Benefactor	Demolition Man	The Ignition Factor	In Search of Dr. Riptide	Jazz Jackrabbit	Mighty Morphin Power Rangers	Novastorm	ClockWerx	Desert Demolition	H.U.R.L.	Jumping Flash!	Lasertank	Lode Runner Online: The Mad Monks' Revenge	Power Pete	Rocks'n'Diamonds	Rollin	Spirou	Assault Rigs	Disney's Pinocchio	Marathon Infinity	Pandemonium	Snood	Blast Corps	Frogger	Disney's Hercules	Pandemonium 2	A Bug's Life	Kula World	Sentinel Returns	Swarm	Turok 2: Seeds of Evil	Bugdom	Earthworm Jim: Menace 2 the Galaxy	Gex 3: Deep Cover Gecko	102 Dalmatians: Puppies to the Rescue	The Emperor's New Groove	Gauntlet Dark Legacy	Tigger's Honey Hunt	Dig Dug Deeper	Diva Starz: Mall Mania	Jurassic Park III: Island Attack	Toki Tori	Dinotopia: The Timestone Pirates	Kururin Paradise	Sven Bømwøllen	Marble Blast Gold	Acky's XP Breakout	Bugdom 2	Kururin Squash!	Nanosaur 2: Hatchling	Archer Maclean's Mercury	Pizza Frenzy	X-Moto	Armadillo Run	Cloning Clyde	Gibbage	Tasty Planet	UPIXO In Action: Mission in Snowdriftland	Video Game TYCOON	Crush	Enigma	Ricochet Infinity	Venice	StoneLoops! of Jurassica	Giana Sisters DS	Manky	Rolando 2: Quest for the Golden Orchid	Weekend Party: Fashion Show	Eversion	Pocket Frogs	Tasty Planet: Back for Seconds	How	Orcs Must Die! 2	Perspective	Rose and Time	Run Roo Run	140	Bit.Trip Presents Runner2: Future Legend of Rhythm Alien
Nobunaga's Ambition	Phantasy Star	Shin Onigashima	Snatcher	Mother	TM Network: Live in Power Bowl	The Krion Conquest	SD Snatcher	Knights of Xentar	Metal Slader Glory	Time Twist: Rekishi no Katasumi de...	Totally Rad	Ufouria: The Saga	Lunar: The Silver Star	Romancing SaGa	EarthBound	Lightning Warrior Raidy	Lunar: Eternal Blue	The Legend of Sword and Fairy	Magic Knight Rayearth	Princess Maker	Secret of Evermore	Terranigma	Albert Odyssey: Legend of Eldean	Lunar: Silver Star Story Complete	PoPoLoCrois	Shining Wisdom	Sound Novel Tsukūru	Bloody Roar	Grandia	Klonoa: Door to Phantomile	Princess Crown	Silhouette Mirage	Apocalypse	Goemon's Great Adventure	Lunar 2: Eternal Blue Complete	Resident Evil 2	Tail Concerto	Gorky 17	The Misadventures of Tron Bonne	Planet Laika	7 Blades	Bloody Roar 3	The Bouncer	Custom Robo V2	Mega Man X5	Sin and Punishment	Ico	Jade Cocoon 2	Klonoa: Empire of Dreams	Mega Man X6	Mister Mosquito	Star Ocean: Blue Sphere	Zone of the Enders	Densetsu no Stafy	Hamtaro: Ham-Ham Heartbreak	Lunar Legend	Onimusha 2: Samurai's Destiny	Drakengard	Fullmetal Alchemist and the Broken Angel	Mega Man Battle Chip Challenge	Shadow Tower Abyss	Viewtiful Joe	Ys: The Ark of Napishtim	Zone of the Enders: The 2nd Runner	Cave Story	Cy Girls	The Legend of Heroes: Trails in the Sky	Onimusha 3: Demon Siege	Viewtiful Joe 2	10,000 Bullets	Chibi-Robo!	Code Age Commanders: Tsugu Mono Tsuga Reru Mono	Devil May Cry 3: Dante's Awakening	Grandia III	La-Mulana	Lunar: Dragon Song	Resident Evil 4	Sakura Wars: So Long, My Love	Shadow of the Colossus	Suikoden Tactics	Yume Nikki	.hack//G.U.	Chōsōjū Mecha MG	Contact	Mother 3	Ōkami	Onimusha: Dawn of Dreams	Disney Princess: Enchanted Journey	Drone Tactics	Lost Odyssey	Nights: Journey of Dreams	Odin Sphere	Operation Darkness	Opoona	Silent Hill: Origins	Patapon 2	Suikoden Tierkreis	The Wizard of Oz: Beyond the Yellow Brick Road	Arc Rise Fantasia	Bayonetta	Little King's Story	Resident Evil: The Darkside Chronicles	Sakura Note: Ima ni Tsunagaru Mirai	Fate/Extra	Ni no Kuni	No More Heroes 2: Desperate Struggle	Ōkamiden	The Legend of Heroes VII	Xenoblade Chronicles	Grand Knights History	The Last Story	Ragnarok Tactics	Yakuza: Dead Souls	Dragon's Dogma	Genso Suikoden: Tsumugareshi Hyakunen no Toki	Drakengard 3	The Wonderful 101
Zork	Deadline	Starcross	Enchanter	Infidel	Planetfall	Valley of the Minotaur	The Witness	Cutthroats	The Hitchhiker's Guide to the Galaxy	Seastalker	Sorcerer	Suspect	Ballyhoo	Fooblitzky	A Mind Forever Voyaging	Spellbreaker	Wishbringer	Amnesia	Hollywood Hijinx	Leather Goddesses of Phobos	Trinity	Beyond Zork	Border Zone	Bureaucracy	The Lurking Horror	Nord and Bert Couldn't Make Head or Tail of It	Plundered Hearts	Sherlock: The Riddle of the Crown Jewels	Stationfall	Quarterstaff: The Tomb of Setmoth	Zork Zero	Arthur: The Quest for Excalibur	James Clavell's Shōgun	Journey	Mines of Titan	The Lost Treasures of Infocom	Zork Nemesis	Zork: Grand Inquisitor	Zork: The Undiscovered Underground
Duke Nukem: Manhattan Project	Geometry Wars	Xbox Music Mixer	Alien Hominid	Gish	Rag Doll Kung Fu	4th British Academy Video Games Awards	Fancy Pants Adventures	Flow	LocoRoco	Mainichi Issho	5th British Academy Video Games Awards	LocoRoco Cocoreccho	Pain	Piyotama	Afrika	Auditorium	Bionic Commando Rearmed	Castle Crashers	Echochrome	Linger in Shadows	LittleBigPlanet (PlayStation 3)	N+	Off-Road Velociraptor Safari	Peggle Nights	PixelJunk Eden	Reset Generation	Too Human	Vigilante 8 Arcade	6th British Academy Video Games Awards	And Yet It Moves	Flower	Gravity Crash	I Made a Game with Zombies in It!	The Maw	Mecho Wars	Noby Noby Boy	PixelJunk Shooter	Space Invaders Infinity Gene	Spelunky	'Splosion Man	Synth	Teenage Mutant Ninja Turtles: Turtles in Time Re-Shelled	Trials HD	Dark Void	DeathSpank	DeathSpank: Thongs of Virtue	Doritos Crash Course	Happy Wheels	Joe Danger	Kinect Sports	Limbo	MicroBot	Planet Minigolf	Raskulls	Scott Pilgrim vs. the World: The Game	Snoopy Flying Ace	Super Meat Boy	Un Juego de Huevos	The Adventures of Shuggy	The Baconing	Bastion	Bionic Commando Rearmed 2	Child of Eden	From Dust	The Gunstringer	Insanely Twisted Shadow Planet	Jamestown: Legend of the Lost Colony	Ms. Splosion Man	Swarm	Tales from Space: About a Blob	Toy Soldiers: Cold War	Under Siege	Where is my Heart?	Black Knight Sword	Dustforce	Fable Heroes	Journey	Mutant Mudds	Trials Evolution	The Unfinished Swan	Alien Spidy	Charlie Murder	Final Exam	Ride to Hell: Retribution	The Bridge	Nidhogg	Trials Fusion
Back to Skool	Famicom Tantei Club Part II: Ushiro ni Tatsu Shōjo	Bakushō! Ai no Gekijō	My Life My Love: Boku no Yume: Watashi no Negai	Dekitate High School	Lunar: Samposuru Gakuen	True Love	Corpse Party	Season of the Sakura	Three Sisters' Story	Haunted Junction	Mahō Gakuen Lunar!	X-Change (visual novel)	Casual Romance Club	Kokoro	Sentimental Graffiti	Kana: Little Sister	Kita e	X-Change 2	Bible Black	Doushin: Same Heart	Memories Off 2nd	Never 7: The End of Infinity	Crescendo (visual novel)	Do You Like Horny Bunnies?	Green Green (visual novel)	Kango Shicyauzo	Discipline: Record of a Crusade	Heart de Roommate	Hourglass of Summer	Princess Holiday	Secret Wives' Club	Tokimeki Memorial Girl's Side	Virgin Roster	Cross Channel	December When There Is No Angel	Gakuen Heaven	Orange Pocket	Pick Me, Honey!	Akai Ito	Amorous Professor Cherry	Cat Girl Alliance	Day of Love	Full House Kiss	Like Life	ObsCure	Pure Pure Mimi to Shippo no Monogatari	School Tycoon	Sora no Iro, Mizu no Iro	Symphonic Rain	Happiness! (visual novel)	Kusari	Nursery Rhyme (visual novel)	The Rub Rabbits!	Sharin no Kuni, Himawari no Shōjo	Yume Miru Kusuri: A Drug That Makes You Dream	Harukoi Otome	Kono Aozora ni Yakusoku o	Otometeki Koi Kakumei Love Revo!!	Princess Princess (manga)	Princess Waltz	RapeLay	Sono Hanabira ni Kuchizuke o	Tokimeki Memorial Girl's Side: 2nd Kiss	Gakuen Utopia Manabi Straight!	HoneyComing	Iriya no Sora, UFO no Natsu	Kirakira (visual novel)	Silent Hill: The Arcade	Aoi Shiro	Dangerous High School Girls in Trouble!	Furifuri	Nogizaka Haruka no Himitsu	Time Hollow	Dengeki Gakuen RPG: Cross of Venus	Flyable Heart	Hoshizora no Memoria	Itazura Gokuaku	Katawa Shoujo	Last Bullet	LovePlus	Maji de Watashi ni Koi Shinasai!	Mashiroiro Symphony	The Path	Starry Sky	Suzunone Seven!	Tokimeki Memorial 4	The Flower Shop	Iro ni Ide ni Keri Waga Koi wa	Memories Off: Yubikiri no Kioku	RE: Alistair	Sexy Beach Zero	Subarashiki Hibi	Tokimeki Memorial Girl's Side: 3rd Story	Amnesia (visual novel)	Code 18	Don't Take It Personally, Babe, It Just Ain't Your Story	Dunamis 15	Magical Diary	Nichijou	Ro-Kyu-Bu!	Diabolik Lovers	Mahōtsukai no Yoru	Photo Kano	Sentou Gakuen	Book of Potions	Conception II: Children of the Seven Stars	Disorder 6	Love Live!	The Pet Girl of Sakurasou
Habitat	Legend of the Red Dragon	LPMud	Angband	BatMUD	BattleTech Centers	Shattered World	Top Management	Dragon's Gate	Neverwinter Nights (MMORPG)	Genocide (online game)	JediMUD	Legends of Future Past	Medievia	Northern Crossroads	The Shadow of Yserbius	UnReal World	MajorMUD	HoverRace	BurningMUD	Castle Infinity	DragonRealms	The Elder Scrolls II: Daggerfall	Freeciv	Furcadia	Microsoft Ants	Threshold (online game)	Enemy Nations	Theme Hospital	Grendel's Cave	Underlight	Vangers	Demise: Rise of the Ku'tan	Era Online	Infantry	Soda Constructor	StarPeace	Icewind Dale II	Laser Squad Nemesis	Lux	Neverwinter Nights	Space Trader (Palm OS)	Tres Lunas	Endless Ages	Istaria: Chronicles of the Gifted	Martial Kingdoms	Shadowbane	A Tale in the Desert	Multi Theft Auto	The Political Machine	World of Warcraft	Club Penguin	Food Force	Nexuiz	Line Rider	McDonald's Videogame	Neverwinter Nights: Darkness over Daggerford	Red Light Center	Shot Online	Wurm Online	Blockland	Flash Element TD	PeaceMaker	SimPort	The Sims Carnival	Space Trader	Adventure Rock	Age of Conan: Unchained	Ai Space	Forumwarz	FunOrb	Incredibots	Google Lively	Viva Piñata: Pocket Paradise	Warhammer Online: Age of Reckoning	Gbanga	Grandia Online	Zero Hour: America's Medic	Moonbase Alpha	Glitch	Pyongyang Racer	Tales of Maj'Eyal
Halo: Combat Evolved	Halo 2	Battlefield 2	Gears of War	Lost Planet: Extreme Condition	Phantasy Star Universe	Resistance: Fall of Man	SOCOM: U.S. Navy SEALs Combined Assault	Call of Duty 4: Modern Warfare	Enemy Territory: Quake Wars	Halo 3	Mass Effect	Soldier of Fortune: Payback	Super Stardust HD	TimeShift	Uncharted: Drake's Fortune	Undertow	Unreal Tournament 3	Warhawk	Frontlines: Fuel of War	Gears of War 2	Resistance 2	SOCOM: U.S. Navy SEALs Confrontation	Borderlands	Call of Duty: Modern Warfare 2	Halo 3: ODST	Killzone 2	Red Faction: Guerrilla	Resident Evil 5	Resistance: Retribution	Section 8	Shattered Horizon	Uncharted 2: Among Thieves	BioShock 2	Halo: Reach	Just Cause 2	Lost Planet 2	Medal of Honor	Naughty Bear	Red Dead Redemption	Bulletstorm	Call of Duty: Modern Warfare 3	Crysis 2	Dead Space 2	Gears of War 3	Halo: Combat Evolved Anniversary	Iron Brigade	Killzone 3	Rage	Red Faction: Armageddon	Resistance 3	Stronghold 3	Uncharted 3: Drake's Deception	Halo 4	Mass Effect 3	Medal of Honor: Warfighter	War of the Roses	Painkiller: Hell & Damnation	Battlefield 4	Call of Duty: Ghosts	Halo: Spartan Assault	Pikmin 3	Rising Storm	Titanfall
Cooking Mama	Build-A-Bear Workshop	Chocolatier	Cooking Mama 2: Dinner with Friends	Cooking Mama: Cook Off	Cooking Mama: World Kitchen	What's Cooking? with Jamie Oliver	Chocolatier: Decadence by Design	Food Network: Cook or Be Cooked	Gardening Mama	Babysitting Mama	ChefVille
Castle Wolfenstein	Thief: The Dark Project	Thief II: The Metal Age	Nusutto Kōza	Sly Cooper and the Thievius Raccoonus	The Chronicles of Riddick: Escape from Butcher Bay	Hitman: Contracts	Sly 2: Band of Thieves	Thief: Deadly Shadows	Sly 3: Honor Among Thieves	Stolen	Gunpoint	Sly Cooper: Thieves in Time	Tiny Thief	Thief
Death Race	Fonz	Night Driver	Turbo	Pole Position	TX-1	Overdrive	Hang-On	Road Blaster	Out Run	Super Sprint	WEC Le Mans	APB	Final Lap	Super Hang-On	Power Drift	Ivan 'Ironman' Stewart's Super Off Road	Rad Mobile	Checkered Flag	Danny Sullivan's Indy Heat	Virtua Racing	Daytona USA	Manx TT Super Bike	Cruis'n World	GTI Club	San Francisco Rush: Extreme Racing	Harley-Davidson & L.A. Riders	F355 Challenge	Hydro Thunder	San Francisco Rush 2049	18 Wheeler: American Pro Trucker	Daytona USA 2001	NASCAR Arcade	Sega GT	OutRun 2	Midway Arcade Treasures 3	Cruis'n	OutRun Online Arcade
