Fire Emblem: Shadow Dragon and the Blade of Light	Fire Emblem Gaiden	Shining Force	Feda: The Emblem of Justice	Fire Emblem: Mystery of the Emblem	Tactics Ogre: Let Us Cling Together	Fire Emblem: Genealogy of the Holy War	BS Fire Emblem: Archanea Senki	Fire Emblem: Thracia 776	Tactics Ogre: The Knight of Lodis	Tear Ring Saga	Fire Emblem: The Binding Blade	Fire Emblem	Fire Emblem: The Sacred Stones	Fire Emblem: Path of Radiance	Fire Emblem: Radiant Dawn	Fire Emblem: Shadow Dragon	Dragon Quest Wars	Fire Emblem Awakening
3D Monster Maze	Wayout	3D Deathchase	Alchemist	Atic Atac	Automonopoli	Bugaboo (The Flea)	Cassette 50	Chuckie Egg	Cookie	Halls of the Things	Jetpac	Knot in 3D	Lords of Time	Manic Miner	Spectrum Safari	Urban Upstart	Valhalla	Winged Warlords	All or Nothing	Bruce Lee	Daley Thompson's Decathlon	Deus Ex Machina	Dragontorc	Eureka!	The Great Space Race	Hareraiser	Hercules	Invasion of the Body Snatchas!	Jet Set Willy	Karyssia: Queen of Diamonds	Knight Lore	Kokotoni Wilf	The Lords of Midnight	Millionaire	Oh Mummy	Pyjamarama	Sabre Wulf	Seiddab Trilogy	Starquake	System 15000	Technician Ted	Tir Na Nog	Underwurlde	The Warlock of Firetop Mountain	Zig Zag	Action Biker	Alien 8	Back to the Future	Blade Runner	Boffin	Brian Bloodaxe	Cauldron	Charlie and the Chocolate Factory video games	Cops 'n' Robbers	Don't Buy This	Fairlight	The Fourth Protocol	Frankie Goes to Hollywood	Friday the 13th	Infernal Runner	Jet Set Willy II	Monty Is Innocent	Monty on the Run	Nodes of Yesod	One Man and His Droid	Rambo	Saboteur	Skool Daze	Soft Aid	Summer Games II	The Rats	10th Frame	180	Agent X	Attack of the Killer Tomatoes	Bobby Bearing	Cauldron II: The Pumpkin Strikes Back	Dan Dare: Pilot of the Future	Future Knight	Glider Rider	Jack the Nipper	Light Force	Molecule Man	Pentagram	Sanxion	Survivors	Sweevo's World	The Trap Door	Action Force	Agent X II: The Mad Prof's Back	Andy Capp: The Game	Auf Wiedersehen Monty	Captain America in: The Doom Tube of Dr. Megalomann	Cybernoid	Dark Sceptre	Exolon	Game Over	Game Over II	Head over Heels	Jinxter	Joe Blade	Match Day II	Saboteur II: Avenging Angel	Streaker	Trantor: The Last Stormtrooper	Werewolves of London	Soft & Cuddly	Stifflip & Co.	19 Part One: Boot Camp	La Abadía del Crimen	ATF	By Fair Means or Foul	Emlyn Hughes International Soccer	Mindfighter	Rex	Savage	Silkworm	Target: Renegade	Time and Magik	Vixen	Where Time Stood Still	Dragons of Flame	Human Killing Machine	Saint Dragon	Stormlord	Tomcat	Perestroika	Back to the Future Part III	CJ's Elephant Antics	Dalek Attack	Turbo the Tortoise	Biniax
Evolution: The Game of Intelligent Life	Creatures 2	Zoo Vet	Wildlife Tycoon: Venture Africa	Fizzball	My Animal Centre in Africa	Viva Piñata	Venture Arctic	Petz Rescue: Ocean Patrol	Spore	Spore Creature Creator	Spore Creatures	Spore Origins	Viva Piñata: Trouble in Paradise	SimAnimals	Spore Hero	The Hunter	World of Zoo	Cabela's Big Game Hunter 2012
Monte Carlo	American Dream	Casino Kid	Vegas Dream	Hot Slots	Poker Face Paul	Super Caesars Palace	Vegas Stakes	Super Casino 2	Slingo	Golden Nugget 64	Las Vegas Cool Hand	Caesars Palace 2000	Tringo	Zynga Poker
Star Fire	Moon Cresta	Astrosmash	Laser Blast	Sneakers	Stargate	TI Invaders	Vanguard	Atlantis	Liberator	Nautilus	Parsec	Time Pilot	The Dreadnaught Factor	Thunder Force	Battle Wings	Gaplus	Gauntlet	Section Z	Sky Destroyer	The Super Dimension Fortress Macross (Family Computer)	Tiger Heli	Volguard II	Zunō Senkan Garu	Darwin 4078	Halley's Comet	Hyper Dyne Side Arms	Layla	Legendary Wings	Slap Fight	Zanac	Air Fortress	Galaga '88	SDI (arcade game)	Sky Fox (arcade game)	Armalyte	Heavy Unit	Image Fight	Thunder Force II	Truxton	Battle Squadron	Dynowarz: Destruction of Spondylus	Fire Shark	Hellfire	R-Type II	To the Earth	U.N. Squadron	Zero Wing	Air Buster	Arrow Flash	Out Zone	Raiden	Silver Surfer	Steel Gunner	Thunder Force III	USAAF Mustang	XDR	Zarlor Mercenary	Acrobat Mission	Armed Police Unit Gallop	Earth Defense Force	Llamatron	Metal Black	Phalanx	Turrican II: The Final Fight	Apidya	Battle Clash	Bio-Hazard Battle	Chikyū Kaihō Gun ZAS	Gley Lancer	Grid Seeker: Project Storm Hammer	Kiloblaster	Last Resort	R-Type Leo	Robo Aleste	Soldier Blade	Steel Empire	Super Aleste	Thunder Force IV	Varth: Operation Thunderstorm	Batsugun	BioMetal	Daioh	Darius Force	Eliminate Down	Raiden II	Super Dimension Fortress Macross: Scrambled Valkyrie	Total Eclipse	Under Fire	Darius Gaiden	Lethal Enforcers II: Gun Fighters	Raptor: Call of the Shadows	Steam-Heart's	DonPachi	The Raiden Project	Strikers 1945	Tyrian	Viper Phase 1	19XX: The War Against Destiny	Battle Garegga	Kingdom Grand Prix	Raiden Fighters	RayStorm	Skull Fang: Kuhga Gaiden	Stargunner	Terra Diver	Chō Jikū Yōsai Macross: Ai Oboete Imasu ka	DoDonPachi	Mystical Ninja Starring Goemon (Game Boy)	Oystron	Raiden Fighters 2	Shienryu	Thunder Force V	Dangun Feveron	Radiant Silvergun	Raiden Fighters Jet	RayCrisis	Bangai-O	Battle Bakraid	Giga Wing	1944: The Loop Master	Mars Matrix: Hyper Solid Shooting	Psyvariar	Silpheed: The Lost Planet	Vasara	Ikaruga	Iridion 3D	Progear	Zero Gunner 2	DoDonPachi DaiOuJou	Gridrunner++	XII Stag	Border Down	Brave Shot	Chaos Field	Jets'n'Guns	Ibara	Nanostray	Plobb!	Raiden III	Neon Wars	Clean Asia!	Nucleus	Raiden IV	Söldner-X: Himmelsstürmer	DoDonPachi DaiFukkatsu	Dariusburst	Genetos	Space Storm	Bit.Trip Fate	Cosmos X2	Minotaur Rescue	Minotron: 2112	Five A Day	Super Ox Wars	Super Stardust Delta	Wreckateer
Tiny Toon Adventures: Babs' Big Break	Goof Troop	The Hive	Shining Force Gaiden: Final Conflict	Montezuma's Return!	Obsidian	Urban Runner	Bomberman Max	Max Payne	Dark Angel	Dark Chronicle	Max Payne 2: The Fall of Max Payne	Ice Station Santa	Chariots of the Dogs	Memento Mori	Moai Better Blues	Night of the Raving Dead	Sonic Riders: Zero Gravity	What's New, Beelzebub?	Where the Wild Things Are	Poker Night at the Inventory	Sam & Max: The Devil's Playhouse	Max Payne 3
Grand Prix Manager	Revs	Formula One	World Grand Prix	Grand Prix Simulator	Taito Grand Prix: Eikou heno License	Super Monaco GP	Tail to Nose	Al Unser Jr.'s Turbo Racing	Michael Andretti's World GP	Bill Elliott's NASCAR Challenge	Formula One: Built to Win	F1 Circus MD	F1 Grand Prix: Nakajima Satoru	Fastest 1	Aguri Suzuki F-1 Super Driving	Ayrton Senna's Super Monaco GP II	Battle Grand Prix	F-1 Grand Prix	F-1 Hero MD	Formula One Grand Prix	Nakajima Satoru Kanshū F1 Super License	Nigel Mansell's World Championship Racing	Super F-1 Hero	Super F1 Circus	Top Gear	F-1 Grand Prix Part II	F-1 Sensation	F1	F1 ROC II: Race of Champions	IndyCar Racing	F-1 Grand Prix Part III	Formula One World Championship: Beyond the Limit	Human Grand Prix III: F1 Triple Battle	Mario Andretti Racing	NASCAR Racing	Super Indy Champ	Zero4 Champ RR	Human Grand Prix IV: F1 Dream Battle	Formula 1	Grand Prix 2	Grand Prix Manager 2	GT Racing	NASCAR Racing 2	F1 Pole Position 64	Formula 1 97	Gran Turismo	Thunder Truck Rally	F-1 World Grand Prix	Racing Simulation 2	Formula One 99	F1 2000	NASCAR Rumble	Spirit of Speed 1937	EA Sports F1 2001	Formula One 2001	Dhaka Racing	Formula One 2002	GP Challenge	Grand Prix 4	NASCAR Thunder 2003	NASCAR: Dirt to Daytona	TD Overdrive: The Brotherhood of Speed	TOCA Race Driver	ChoroQ	Formula One 2003	Midtown Madness 3	NASCAR Racing 2003 Season	NASCAR Thunder 2004	Formula One 04	NASCAR 2005: Chase for the Cup	TOCA Race Driver 2	Cross Racing Championship Extreme 2005	Formula One 05	Jak X: Combat Racing	NASCAR 06: Total Team Control	FlatOut 2	Formula One 06	Formula One Championship Edition	Juiced: Eliminator	MotoGP 4	Ridge Racer 7	TOCA Race Driver 3	Project Torque	IRacing.com	Build 'n Race	Days of Thunder	F1 2009	Supercar Challenge	F1 2010	3D Pixel Racing	Days of Thunder	F1 2011	Grand Prix Story	NASCAR The Game: 2011	F1 Race Stars	F1 2012	NASCAR The Game: Inside Line	F1 2013	Grid 2	NASCAR '14
Football	Realsports Football	10-Yard Fight	Computer Football Strategy	NFL Challenge	Tecmo Bowl	Tecmo Super Bowl	John Madden Football '93	NFL Sports Talk Football '93	Pro Quarterback	Mutant League Football	NFL Quarterback Club	Tecmo Super Bowl II: Special Edition	Tecmo Super Bowl III: Final Edition	Madden NFL '96	NFL Blitz	Madden NFL 99	Backyard Football	Madden NFL 2001	Chaos League	ESPN NFL 2K5	Madden NFL 2005	NFL Street	NFL Street 2	Blitz: The League	Madden NFL 06	NCAA Football 06	Arena Football	Madden NFL 07	NCAA Football 07	NFL Head Coach	NFL Street 3	All-Pro Football 2K8	Gaelic Games: Football 2	Madden NFL 08	NFL Head Coach 09	NFL Tour	UEFA Euro 2008	Madden NFL 10	NCAA Football 10	Backbreaker	EA Sports Active NFL Training Camp	Madden NFL 11	NCAA Football 12	Madden NFL 13	NCAA Football 13	Madden NFL 25
Haunted House	Moonlight Madness	Maniac Mansion	Splatterhouse	Splatterhouse: Wanpaku Graffiti	Sweet Home	Splatterhouse 2	Mansion of Hidden Souls	Splatterhouse 3	The 11th Hour	Clock Tower	Nocturnal Illusion	Casper	Clock Tower	The House of the Dead	Resident Evil	The Note	Casper	Juggernaut	Nanatsu no Hikan	Fatal Frame	One Piece Mansion	Casper	Grabbed by the Ghoulies	Deep Labyrinth	Playboy: The Mansion	The Hardy Boys: The Hidden Theft	Caucasus: Nanatsuki no Nie	Business Tycoon Online
Dread Dragon Droom	Spelunker II: Yūsha e no Chōsen	Deliverance: Stormlord II	Monstania	Doraemon: Nobita to Mittsu no Seireiseki	Frogger: The Great Quest	ZanZarah: The Hidden Portal	The Fairly OddParents: Breakin' da Rules	Dream Chronicles	Dream Chronicles 2: The Eternal Maze	Pixie Hollow	Dream Chronicles: The Chosen Child	Dream Chronicles: The Book of Air	Dream Chronicles: The Book of Water
Genghis Khan	Bandit Kings of Ancient China	King's Bounty	Castles	Lord Monarch	Warsong	Dune	Fantasy Empires	Liberty or Death	Lords of the Realm	Heroes of Might and Magic: A Strategic Quest	Warhammer: Shadow of the Horned Rat	Dragon Force	War Diary	Brigandine	Warrior Kings	Dominions II: The Ascension Wars	Romance of the Three Kingdoms IX	Knights of Honor	Imperivm: Great Battles of Rome	The Settlers: Heritage of Kings	Stronghold 2	Dominions 3: The Awakening	Saga	Three Kingdoms Online	Castle of Heroes	Hills and Rivers Remain	Settlement Fight	The Kings' Crusade	Clash of Clans	Skyshard Heroes
Hugo's House of Horrors	Hugo	Hugo III, Jungle of Doom!	Hugo: Quest for the Sunstones	Hugo: The Evil Mirror	Hugo Troll Race
Crash Bandicoot	Crash Bandicoot 2: Cortex Strikes Back	Doctor Who: Destiny of the Doctors	Crash Bandicoot: Warped	Crash Bash	Crash Bandicoot: The Wrath of Cortex	Crash Bandicoot: The Huge Adventure	Crash Bandicoot 2: N-Tranced	Crash Twinsanity	Crash Tag Team Racing	Crash of the Titans	Crash: Mind over Mutant	Doctor Who: The Adventure Games
Terrorist	Hover Force	Hostages	The President is Missing	Die Hard	Cliffhanger	Crime Patrol	Maximum Force	Mission: Impossible	Police Quest: SWAT 2	Silent Scope	SWAT 3: Close Quarters Battle	Syphon Filter	Aconcagua	Carrier	Covert Ops: Nuclear Dawn	Delta Force: Land Warrior	Syphon Filter 2	Hidden Invasion	Secret Service	Syphon Filter 3	Die Hard: Vendetta	Silent Scope 3	SOCOM: U.S. Navy SEALs	SOCOM II: U.S. Navy SEALs	Syphon Filter: The Omega Strain	Nemesis Strike	Without Warning	24: The Game	Syphon Filter: Dark Mirror	Syphon Filter: Logan's Shadow	Conflict: Denied Ops	SAS: Secure Tomorrow	Mass Effect Galaxy
Oink!	DeHackEd	Babyz	Elasto Mania	Diablo II: Lord of Destruction	Championship Manager 5	Darwinia	Age of Pirates: Caribbean Tales	Command & Conquer: The First Decade	Medal of Honor: Airborne	Euro Truck Simulator	Football Manager 2009	Raiden Fighters Aces	Anno 1404	Ashes Cricket 2009	Precursors	Stormrise	Mortal Online	World of Warcraft: Cataclysm	Fate of the World	IL-2 Sturmovik: Cliffs of Dover	World Gone Sour	X3: Albion Prelude	Escape Plan	X Rebirth	Diablo III: Reaper of Souls
President Elect	Under Fire!	Sorcerian	Romance of the Three Kingdoms II	Koutetsu no Kishi	V for Victory: D-Day Utah Beach	Siege	Genghis Khan II: Clan of the Gray Wolf	Operation Europe: Path to Victory	Panzer General	Capitalism	Koutetsu no Kishi 3: Gekitotsu Europe Sensen	Civilization II	Dark Savior	Pacific General	Panzer General II	Shining Force III	Knights and Merchants: The Shattered Kingdom	The Operational Art of War	People's General	Railroad Tycoon II	Tom Clancy's ruthless.com	Civilization II: Test of Time	Fleet Command	Combat Mission: Beyond Overlord	Kessen	Steel Beasts	Empire Earth	Europa Universalis II	Knights and Merchants: The Peasants Rebellion	Trade Empires	Empire Earth: The Art of Conquest	Civilization III: Conquests	Defense of the Ancients	Empires: Dawn of the Modern World	Highway to the Reich	Railroad Tycoon 3	Resident Evil Outbreak	Chris Sawyer's Locomotion	Lords of the Realm III	Outpost Kaloki X	Resident Evil Outbreak File 2	Romance of the Three Kingdoms X	Universal Combat	Dangerous Waters	Empire Earth II	Empire Earth II: The Art of Supremacy	President Forever 2008 + Primaries	Romance of the Three Kingdoms XI	Sid Meier's Railroads!	Strategic Command 2: Blitzkrieg	Civilization IV: Beyond the Sword	Making History: The Calm & The Storm	Operation Barbarossa – The Struggle for Russia	Command Ops: Battles from the Bulge	Making History II: The War of the World	Darkest Hour: A Hearts of Iron Game	Dawn of Fantasy	Command: Modern Air Naval Operations
The Great Escape	KZ Manager	Gothic	Prisoner of War	Gothic II: Night of the Raven	Prison Tycoon	Darfur is Dying	Disney Sing It	Madagascar: Escape 2 Africa	Zeebo F.C. Foot Camp
Odyssey: The Compleat Apventure	Dough Boy	Raid on Bungeling Bay	Airheart	Takeshi no Chōsenjō	Getsu Fūma Den	Rainbow Islands: The Story of Bubble Bobble 2	Carrier Command	Midwinter	The Secret of Monkey Island	Mega Lo Mania	Monkey Island 2: LeChuck's Revenge	Parasol Stars	Creatures II: Torture Trouble	Ishar	Fire 'n Ice	Isle of the Dead	Little Big Adventure	Fade to Black	Super Adventure Island II	Pyst	Timelapse	Croc: Legend of the Gobbos	The Curse of Monkey Island	Galapagos (computer game)	Little Big Adventure 2	The Tone Rebellion	Blue Stinger	Doshin the Giant	Survival Kids	Eagle One: Harrier Attack	Escape from Monkey Island	Flower, Sun, and Rain	Beach Life	Herdy Gerdy	Dead or Alive Xtreme Beach Volleyball	Freaky Flyers	Tibia Micro Edition	Return to Mysterious Island	Lost in Blue	Nano Breaker	Tribal Trouble	Anno 1701	Forbidden Siren 2	Jaws Unleashed	Let's Go Jungle!: Lost on the Island of Spice	Virtual Villagers	Vivisector: Beast Within	Dead Reefs	DK Jungle Climber	Kurikin Nano Island Story	Lost in Blue 3	One Piece: Unlimited Adventure	The Sims 2: Castaway	Fossil Fighters	Harvest Moon DS: Sunshine Islands	MySims Kingdom	King's Bounty: Armored Princess	Return to Mysterious Island 2	Tales of Monkey Island	Zettai Zetsumei Toshi 3: Kowareyuku Machi to Kanojo no Uta	Snowpack Park	Treasure Isle (Zynga game)	Carrier Command: Gaea Mission	Miasmata	Nayuta no Kiseki	Glorious Mission
Target Earth	Wing Commander	Wing Commander II: Vengeance of the Kilrathi	Wings	Wings 2: Aces High	Star Wars: X-Wing	Star Wars: TIE Fighter	Wing Commander III: Heart of the Tiger	Star Wars: X-Wing vs. TIE Fighter	Wing Commander: Prophecy	Star Wars: X-Wing Alliance	Final Fantasy XII: Revenant Wings
The Black Bass	Sugoi Hebereke	Dragon Ball GT: Final Bout	Custom Robo	Super Smash Bros.	Super Smash Bros. Melee	Dragon Ball GT: Transformation	One Piece: Grand Battle! Rush	Super Dragon Ball Z	Dragon Ball Z: Burst Limit	Dragon Ball: Origins	Super Smash Bros. Brawl	Dragon Ball Z: Attack of the Saiyans	Dragon Ball: Raging Blast	Dragon Ball: Revenge of King Piccolo	Teenage Mutant Ninja Turtles: Smash-Up	Dragon Ball Z: Tenkaichi Tag Team	Dragon Ball: Raging Blast 2	Dragon Ball Z: Ultimate Tenkaichi	Project M (mod)	TowerFall	Dragon Ball Z: Battle of Z	Sportsfriends
FreeCell (Windows)	Deus	Side Pocket 3	Airline Tycoon	Beach Head 2000	Sissyfight 2000	Cube	Jimmy Neutron: Boy Genius	Laden VS USA	Oddworld: Stranger's Wrath	Roblox	Weird Worlds: Return to Infinite Space	TAGAP: The Apocalyptic Game About Penguins	Free Realms	Machinarium	Minecraft	Arcania: Gothic 4	The Journey Down	Organ Trail	Pier Solar and the Great Architects	Transformice	Afterfall: InSanity	Arcania: Fall of Setarrif	Cart Life	CastleMiner	Crimson Alliance	GunZ 2	MindJack	No Time To Explain	Payday: The Heist	Stealth Bastard Deluxe	Terraria	Wolfenstein 1-D	Baldur's Gate: Enhanced Edition	Basketball Pro Management	Blades of Time	Curiosity – What's Inside the Cube?	Doctor Who: The Eternity Clock	Doom 3 BFG Edition	Dust: An Elysian Tail	Dys4ia	The Elder Scrolls V: Skyrim – Hearthfire	Euro Truck Simulator 2	Farming Simulator	Game Dev Tycoon	Gemini Wars	Giana Sisters: Twisted Dreams	Hero Academy	Infestation: Survivor Stories	Jak and Daxter Collection	Little Inferno	McPixel	Microsoft Flight	Miner Wars 2081	Natural Selection 2	Oil Rush	Oniken	Plague Inc.	Ridge Racer Unbounded	Rose Guns Days	Snops Attack! Zombie Defense	Super Monday Night Combat	Tales from Space: Mutant Blobs Attack	UFC Undisputed 3	The Undead Syndrome	Ziggurat	Ashes Cricket 2013	Baldur's Gate II: Enhanced Edition	The Banner Saga	Castlevania: Lords of Shadow – Mirror of Fate	Cities in Motion 2	Day One: Garry's Incident	Deus Ex: The Fall	Dumb Ways to Die	Fist of Awesome	Guacamelee!	IL-2 Sturmovik: Battle of Stalingrad	The Incredible Adventures of Van Helsing	Leisure Suit Larry: Reloaded	Monster Hunter: Frontier G	Mush	Papers, Please	Proteus	Reus	Shelter	Star Command	SteamWorld Dig	Surgeon Simulator 2013	Takedown: Red Sabre	Tearaway	Teslagrad	The Showdown Effect	Toki Tori 2	Unearthed: Trail of Ibn Battuta	Wizardry Online	Young Justice: Legacy	Banished	Basement Crawl	The Elder Scrolls Online	Goat Simulator	Luftrausers	Mercenary Kings	Moebius: Empire Rising	Plague Inc: Evolved	Secrets of Rætikon	Super Time Force	Tower of Guns	Transistor	Unrest
Akalabeth: World of Doom	Ultima I: The First Age of Darkness	Ultima II: The Revenge of the Enchantress	Ultima III: Exodus	Ultima: Escape from Mt. Drash	Ultima IV: Quest of the Avatar	Ultima V: Warriors of Destiny	Ultima VI: The False Prophet	Worlds of Ultima: The Savage Empire	Ultima: Worlds of Adventure 2: Martian Dreams	Ultima VII: The Black Gate	Ultima Underworld: The Stygian Abyss	Ultima VII Part Two: Serpent Isle	Ultima Underworld II: Labyrinth of Worlds	Ultima VIII: Pagan	Ultima Online	Ultima IX: Ascension	Ultima V: Lazarus	Ultima Forever: Quest for the Avatar
Christmas Lemmings	Lemmings	Oh No! More Lemmings	The Humans	Lemmings 2: The Tribes	All New World of Lemmings	3D Lemmings	The Adventures of Lomax	Lemmings Paintball	Populous: The Beginning	Lemmings Revolution	Theocracy	The Settlers IV	Patapon	Mushroom Men	Lego Legends of Chima: Laval's Journey
Dynamite Cop	Gunbird 2	The Last Blade 2	Millennium Soldier: Expendable	Soulcalibur	Armada	Army Men: Sarge's Heroes	Crazy Taxi	D2	Dead or Alive 2	Seaman	Shenmue	Slave Zero	Wild Metal Country	Confidential Mission	Jet Set Radio	L.O.L.: Lack of Love	MDK2	Midway's Greatest Arcade Hits	Planet Ring	Razor Freestyle Scooter	Resident Evil Code: Veronica	Xtreme Sports	Alone in the Dark: The New Nightmare	Dark Angel: Vampire Apocalypse	Evil Twin: Cyprien's Chronicles	NBA 2K2	Shenmue II	Beats of Rage	Radirgy	Karous	Last Hope	Triggerheart Exelica	Fast Striker	Sturmwind
Dead or Alive 3	Dead or Alive Ultimate	Densetsu no Stafy 4	Fate/tiger colosseum	Naruto: Rise of a Ninja	Naruto: Ultimate Ninja Storm	Record of Agarest War Zero	Yakuza 3	Dead or Alive Paradise	Naruto Shippuden: Ultimate Ninja Storm 2	Super Street Fighter IV	Disney Universe	Gal*Gun	LittleBigPlanet 2	Tekken Tag Tournament 2	Dead or Alive 5	Gravity Rush	LittleBigPlanet PS Vita	Naruto Shippuden: Ultimate Ninja Storm Generations	PlayStation All-Stars Battle Royale	Tekken 3D: Prime Edition	Dead or Alive 5 Plus	Dead or Alive 5 Ultimate	Naruto Shippuden: Ultimate Ninja Storm 3	PlayStation All-Stars Island	Guilty Gear Xrd
SimFarm	Harvest Moon	Harvest Moon GB	Harvest Moon 2 GBC	Harvest Moon 64	Harvest Moon: Back to Nature	Harvest Moon 3 GBC	Harvest Moon: Save the Homeland	Harvest Moon: A Wonderful Life	Harvest Moon: Friends of Mineral Town	Harvest Moon DS	Harvest Moon: Magical Melody	Innocent Life: A Futuristic Harvest Moon	Rune Factory: A Fantasy Harvest Moon	Farm Frenzy	Harvest Moon DS: Island of Happiness	Harvest Moon: Tree of Tranquility	Happy Farm	Harvest Moon: Animal Parade	Rune Factory 2: A Fantasy Harvest Moon	Rune Factory Frontier	Country Life	Farm Town	FarmVille	Plant Tycoon	Rune Factory 3: A Fantasy Harvest Moon	The Pioneer Trail	Harvest Moon: Linking the New World
Snake	Metal Gear	Metal Gear 2: Solid Snake	Snake's Revenge	Metal Gear Solid	Metal Gear: Ghost Babel	Metal Gear Solid 2: Sons of Liberty	Metal Gear Solid 3: Snake Eater	Metal Gear Solid: The Twin Snakes	Metal Gear Solid: Portable Ops	Metal Gear Solid 4: Guns of the Patriots	Metal Gear Solid Mobile	Metal Gear Solid: Peace Walker	Metal Gear Solid HD Collection	Metal Gear Rising: Revengeance	Metal Gear Solid: The Legacy Collection	Metal Gear Solid V: Ground Zeroes
Bomberman	Bomberman '94	Bomberman GB	Bomberman: Panic Bomber	Super Bomberman 2	Super Bomberman 3	Super Bomberman 4	Bomberman 64	Super Bomberman 5	Bomberman Fantasy Race	Bomberman Hero	Bomberman World	Bomberman Online	Bomberman Tournament	Bomberman Generation	Bomberman Jetters	Bomberman Jetters	Bomberman Hardball	Bomberman (Nintendo DS)	Bomberman Land Touch!
Dragon Skulle	Lost Souls (online game)	Soul Blazer	Osu!! Karate Bu	Afterlife	Tecmo's Deception: Invitation to Darkness	Legacy of Kain: Soul Reaver	Omikron: The Nomad Soul	Soul of the Samurai	Mega Man Xtreme 2	Onimusha: Warlords	Soul Reaver 2	Soulcalibur II	Drake of the 99 Dragons	DreamMix TV World Fighters	Gregory Horror Show	Legacy of Kain: Defiance	Maximo vs. Army of Zin	Spawn: Armageddon	Virtua Quest	Castlevania: Dawn of Sorrow	Soulcalibur III	Bleach: Dark Souls	Soulcalibur Legends	Asda Story	Soul Eater (manga)	Demon's Souls	Dante's Inferno	Darksiders	Last Rebellion	Trinity: Souls of Zill O’ll	Bleach: Soul Resurrección	Dark Souls	Rift	Darksiders II	Puppeteer	Dark Souls II
Psychonauts	Epic Saga: Extreme Fighter	My Game About Me: Olympic Challenge	Tasha's Game	Brütal Legend	Host Master and the Conquest of Humor	Costume Quest	Amnesia Fortnight 2012	Double Fine Happy Action Theater	Kinect Party	The Cave	Host Master Deux: Quest for Identity	Amnesia Fortnight 2014	Broken Age
Doomdark's Revenge	Hoshi wo Miru Hito	Miracle Warriors: Seal of the Dark Lord	Tombs & Treasure	Phantasy Star II	Dragon Knight II	Phantasy Star III: Generations of Doom	Wizardry VI: Bane of the Cosmic Forge	Battle of Kingdom	Chaos World	Day Dreamin' Davey	Tenchi wo Kurau II	Arabian Magic	Great Greed	Just Breed	Shining Force Gaiden	Sorcerer's Kingdom	The 7th Saga	ActRaiser 2	Albert Odyssey (Super Famicom game)	Betrayal at Krondor	Guardian War	Mōryō Senki MADARA 2	Phantasy Star IV: The End of the Millennium	Lufia & the Fortress of Doom	Live A Live	Shadowrun	Vay	Albion	Arc the Lad	Beyond the Beyond	Love Quest	Mystaria: The Realms of Lore	Romancing SaGa 3	Suikoden	Tenchi Muyo! Game Hen	Verne World	Energy Breaker	Star Ocean	Treasure Hunter G	Vandal Hearts	Wild Arms	Betrayal in Antara	The Granstream Saga	Lands of Lore: Guardians of Destiny	Shinsetsu Samurai Spirits Bushidō Retsuden	Brave Fencer Musashi	Legend of Legaia	Rhapsody: A Musical Adventure	Suikoden II	TwinBee RPG	Wachenröder	The War of Genesis Side Story I: Rhapsody of Zephyr	Xenogears	Digimon World 3	Evolution: The World of Sacred Device	Little Princess: Marl Ōkoku no Ningyō Hime 2	Revenant	Saiyuki: Journey West	Septerra Core: Legacy of the Creator	Valkyrie Profile	Vandal Hearts II	The War of Genesis III	Wild Arms 2	Grandia II	Keitai Denjū Telefang	Orphen: Scion of Sorcery	Tenshi no Present: Marl Ōkoku Monogatari	Forever Kingdom	Golden Sun	Hoshigami: Ruining Blue Earth	Legaia 2: Duel Saga	Lufia: The Legend Returns	Magna Carta: The Phantom of Avalanche	Shadow Hearts	Divine Divinity	Eternal Darkness: Sanity's Requiem	Magic Pengel: The Quest for Color	Suikoden III	Summoner 2	Tales of Destiny 2	Wild Arms 3	Xenosaga Episode I: Der Wille zur Macht	Arc the Lad: Twilight of the Spirits	Chaos Legion	CIMA: The Enemy	Demonbane	Disgaea: Hour of Darkness	Growlanser Wayfarer of Time	Star Ocean: Till the End of Time	Summon Night: Swordcraft Story	Arc the Lad: End of Darkness	Graffiti Kingdom	Gungrave: Overdose	InuYasha: The Secret of the Cursed Mask	Phantom Brave	Shadow Hearts: Covenant	Stella Deus: The Gate of Eternity	Summon Night: Swordcraft Story 2	Tokyo Majin Gakuen Gehōchō: Keppūroku	The Chronicles of Narnia: The Lion, the Witch and the Wardrobe	Cute Knight	Freedom Force vs the 3rd Reich	Makai Kingdom: Chronicles of the Sacred Tome	Mega Man Battle Network 6	Rogue Galaxy	Shadow Hearts: From the New World	Summon Night Craft Sword Monogatari: Hajimari no Ishi	Wild Arms 4	Auto Assault	Brave Story: New Traveler	Dungeon Siege: Throne of Agony	Enchanted Arms	Genji: Days of the Blade	Jeanne d'Arc	Valkyrie Profile 2: Silmeria	Wild Arms 5	Final Fantasy Crystal Chronicles: Ring of Fates	GrimGrimoire	Luminous Arc	MechQuest	Octomania	Shining Force EXA	Wild Arms XF	Barkley, Shut Up and Jam: Gaiden	Crimson Gem Saga	Disgaea 3: Absence of Justice	Glory of Heracles	Infinite Undiscovery	Spectrobes: Beyond the Portals	Super Robot Taisen OG Saga: Endless Frontier	Zwei II	Black Sigil: Blade of the Exiled	Final Fantasy: The 4 Heroes of Light	Full Metal Daemon: Muramasa	Inquisitor	Muramasa: The Demon Blade	Star Ocean: The Last Hope	A Witch's Tale	Chaos Rings	Faery: Legends of Avalon	Fossil Fighters: Champions	Radiant Historia	Resonance of Fate	Dungeon Siege III	The First Templar	Hyperdimension Neptunia Mk2	Infinity Blade II	Asura's Wrath	Beyond the Labyrinth	Code of Princess	Time and Eternity	Infinity Blade III
Overlord	Minions	Overlord: Raising Hell	Overlord II	Overlord: Dark Legend	Overlord: Minions
Route-16	MotoRace USA	The Great American Cross-Country Road Race	Route-16 Turbo	Turbo Outrun	OutRun 2019	OutRunners	Cool Riders	Smashing Drive	SimCity 4: Rush Hour	Bus Driver	Monster Milktruck
